LEIV AUSTRHEIM AS; NORDSTRANDV 40 ; 6823; SANDANE; BILVERKSTED01, KONTROLLORGAN01; 917672997; 7105
BODØ V. G. SKOLE, BILAVD.; Amtmann Hegges Vei 3/4; 8005; BODØ; KONTROLLORGAN01, BILVERKSTED01; 974621223; 9004
STEINSPRUTEN BILGLASS AS avd Drammen; Teglverksveien 15B; 3401; LIER; BILGLASS; 997719670; 29502
Volmax AS avd. Telemark; Ulefossvegen 48; 3730; SKIEN; FARTSSKRIVER, KONTROLLORGAN04, BILVERKSTEDALLE; 984674104; 4832
SOLHEIM SERVICE AS; Ringveien, 1; 1781; HALDEN; ALKOLASVERKSTED; 922253013; 31374
Johs. Blomdal AS; Røldalsvegen 44; 5750; ODDA; BILVERKSTED01, KONTROLLORGAN01; 985470227; 25362
Møller Bil Jessheim AS avd SKODA, AUDI og Nyttekjøretøy ; Energiveien 1; 2069; JESSHEIM; BILVERKSTED01B, BILSKADE, KONTROLLORGAN01B; 964995923; 1018
Reisa Bilsenter AS; Hovedveien 45; 9152; Sørkjosen; BILVERKSTED01B, BILSKADE, KONTROLLORGAN01B; 829071002; 9527
TEKNISK BUREAU FINNSNES AS; Strandveien 68; 9300; FINNSNES; BILVERKSTED01, KONTROLLORGAN01; 991075682; 11111
Fana Karosseri as; Kokstadveien 31 D; 5257; NESTTUN; BILSKADE; 980383393; 6566
ROVIK MC AS; FABRIKKVEIEN 5; 4033; STAVANGER; MOTORSYKKELOGMOPED; 928634000; 30360
Romerike Auto AS; Hvamveien 4; 2013; STRØMMEN; BILVERKSTED01B, KONTROLLORGAN01B; 989865218; 1049
ISDALSTØ AUTO KNARVIK A/S; Kvassnesvegen 31; 5914; ISDALSTØ; BILVERKSTED01B, BILSKADE, KONTROLLORGAN01B; 944407286; 6617
Karosseriforum AS; Sivesindvegen 1; 2827; HUNNDALEN; BILSKADE; 992884304; 15358
Norsk Motorimport AS; Firdavegen 14; 6801; FØRDE; MOTORSYKKELOGMOPED; 979877838; 16719
RSA Bil Tromsø; Ærfuglvegen 2; 9015; TROMSØ; BILVERKSTED01B, KONTROLLORGAN01B; 915518389; 27521
ENGENE BILVERKSTED; Hemsedalsvegen 2540 ; 3560; HEMSEDAL; BILVERKSTED01, KONTROLLORGAN01; 974349353; 3555
OSLO BILGLASSENTER AS; VERKSEIER FURULUNDS VEI 43; 0668; OSLO; BILGLASS; 912865304; 29571
TEAM VERKSTED TRØNDELAG AS, avd. Steinkjer; Jæktskippergata 3; 7725; STEINKJER; KONTROLLORGAN04, BILVERKSTEDALLE, HJUL, FARTSSKRIVER; 919443022; 30912
Norstrand Bil AS; Sjøvollan 1; 9040; NORDKJOSBOTN; BILVERKSTED01, KONTROLLORGAN01; 917328358; 9589
SENTRUM BILSERVICE NAMSOS AS; Pinavegen 2; 7800; Namsos; BILVERKSTED01B, BILELEKTRODRIVSTOFFANLEGG, KONTROLLORGAN01B; 981897013; 8735
GT Lakk & Karosseri AS; Radøyvegen 2805; 5937; BØVÅGEN; BILSKADE; 981226062; 6655
TELEMARK SALMAKERVERKSTED SIGURDSEN; BATALJONVEIEN 25; 3734; SKIEN; PABYGGER; 983885713; 31067
RIIS MONTASJE AS avd. Nesodden; Myklerudveien 103; 1454; FAGERSTRAND; BILGLASS; 921979436; 29265
Nøtterøy Autoservice AS; Nesbryggveien 4; 3133; DUKEN; BILVERKSTED01, KONTROLLORGAN01; 997737717; 21879
MOBILDEKK AS; CORT ADELERS GATE 35A; 0251; OSLO; HJUL; 919512008; 30595
Toyota Asker og Bærum AS avd Asker; Drengsrudbekken 4; 1385; ASKER; BILVERKSTED01, KONTROLLORGAN01; 950272899; 989
Plassen Bil Magne Trøstheim; Engene; 3550; GOL; BILSKADE; 975898768; 13254
Foss Autoservice; Haugveien 33; 1903; GAN; BILVERKSTED01, KONTROLLORGAN01; 987460814; 1007
VESTLANDSKE TRAILER AS; MOSTERØYVEIEN 86; 4156; MOSTERØY; BILVERKSTED02, BILVERKSTED01, BILVERKSTED03, PABYGGER; 990942242; 30399
CENTRUM BIL & KAROSSERI AS; Dreyfushammarn 10; 8012; BODØ; BILVERKSTED01B, KONTROLLORGAN01B; 961070880; 9085
NAF Senter Jessheim; Energivegen 16; 2069; JESSHEIM; KONTROLLORGAN01; 987372540; 1243
Åskrysset Auto AS; Langbakken 14; 1430; ÅS; BILVERKSTED01B, KONTROLLORGAN01B; 996402029; 17819
BERG KAROSSERIFABRIKK AS; Melhusvegen 161; 7224; MELHUS; MOTORSYKKELOGMOPED, BILVERKSTEDALLE, PABYGGER; 961173000; 31313
TESLA NORWAY AS, avd. Tromsø; Alkevegen 1; 9015; TROMSØ; BILVERKSTED01; 917304084; 29757
H-GLASS AS ; HVITTINGFOSSVEIEN 153; 3086; HOLMESTRAND; BILGLASS; 947530402; 29575
Maks Auto Servis AS; Grenseveien 73; 0663; OSLO; BILVERKSTED01, KONTROLLORGAN01; 952203541; 1341
NORD - AUTO AS; Sjøfartsgata 15; 7714; STEINKJER; BILVERKSTED01, BILVERKSTED01B, KONTROLLORGAN01B; 913951387; 27562
VALLDAL BILSENTER A/S; Valldal; 6211; VALLDAL; BILVERKSTED01, BILVERKSTED02, KONTROLLORGAN01B; 961121094; 7344
Bjørkås Rep og Service; Krutfjellveien 943D; 8690; HATTFJELLDAL; BILVERKSTED01; 992715626; 16500
TYRISTRAND AUTO AS; BRUGSJORDET 1; 3533; TYRISTRAND; BILVERKSTED01, KONTROLLORGAN01; 919415797; 30510
Bilpartner Autoteknikk AS; Stanseveien 2; 0975; OSLO; BILVERKSTED01, KONTROLLORGAN01; 980371107; 1366
Bøler Autoverksted AS; Bølerlia 1; 0691; OSLO; BILVERKSTED01; 979443625; 1425
RØYKEN GLASS AS; SLEMMESTADVEIEN 14; 3440; RØYKEN; BILGLASS; 914830796; 29484
INTERDEKK AS; HOVEMOVEGEN 35; 2624; LILLEHAMMER; HJUL, HENGERESPALOPSBREMSEANLEGG; 981509234; 30021
NAF Senter Sortland ; Strandgata 40; 8400; Sortland; KONTROLLORGAN01, BILVERKSTED01; 987372540; 9326
HASTADKLEV VERKSTED STJØRDAL AS; HOTELLGATA 4; 7500; STJØRDAL; BILVERKSTED01, KONTROLLORGAN01; 921865279; 31093
HØNEFOSS GLASS - SERVICE AS; OSLOVEIEN 31; 3511; HØNEFOSS; BILGLASS; 990190941; 29401
INTAKT BILSKADE STEINKJER AS; Jæktskippergt 7; 7725; Steinkjer; BILSKADE, BILGLASS; 979358806; 8657
Auto Sportiva AS; Maskinistgt. 1; 7042; TRONDHEIM; BILVERKSTED01, KONTROLLORGAN01; 993263990; 14598
Melhus Motor & Fritid; SPURVEVEGEN 6; 7224; MELHUS; TRAKTOR, HENGERESPALOPSBREMSEANLEGG; 914274141; 31488
TRAKTOR AS; FARSUNDSVEIEN 135; 4580; LYNGDAL; TRAKTOR; 986344977; 30308
Overaae AS avd. Stjørdal; Sutterøygt. 13; 7502; STJØRDAL; HJUL; 935872634; 8516
Team Verksted Råde; Langøyveien 3; 1640; RÅDE; FARTSSKRIVER, BILVERKSTEDALLE, KONTROLLORGAN04; 946930342; 30576
Fosnavåg Bilverksted AS; Myklebustvegen 65; 6092; FOSNAVÅG; BILVERKSTED01B, KONTROLLORGAN01B, KONTROLLORGAN01, BILVERKSTED01, BILSKADE; 935444497; 7532
Utvik  Autoservice AS; Karmøyvegen 478; 4262; AVALDSNES; BILVERKSTED01, KONTROLLORGAN01, BILVERKSTED01B, KONTROLLORGAN01B; 951642150; 6321
ÅLESUND DEKK & DEKKHOTELL AS; BLINDHEIM INDUSTRIVEG 2D; 6020; ÅLESUND; HJUL; 921220510; 31208
Motorspeed AS; Hovemovegen 45; 2624; LILLEHAMMER; MOTORSYKKELOGMOPED; 947556819; 2607
Stathelle Auto A/S; Dronning Margrethesvei 3; 3960; STATHELLE; BILVERKSTED01, BILSKADE, KONTROLLORGAN01; 984152329; 4899
Stranda Bil AS; Stranda; 6200; STRANDA; BILVERKSTED01, KONTROLLORGAN01; 993057819; 25962
AUTO-CARAVAN SVEIN-ERIK HANSEN; PANCOVEIEN 24; 1624; GRESSVIK; HENGERESPALOPSBREMSEANLEGG; 921980078; 31326
Krangnes Motor; Lade Alle 4; 7041; TRONDHEIM; MOTORSYKKELOGMOPED; 958749686; 17560
LAKSELV AUTOSENTER AS; Georg Bjørklis vei 1; 9700; LAKSELV; HJUL; 983825443; 28154
SANNIDAL MOTOR  AS; Krokenveien 197; 3766; SANNIDAL; BILVERKSTED01; 982812410; 4838
Bertel O. Steen Østfold AS; Hunnskinnveien 98; 1711; Sarpsborg; BILVERKSTED01B, KONTROLLORGAN01B; 915281168; 106
FILMTEAM NORSK SKILTSERVICE AS; HARALDS VEI 4; 1470; LØRENSKOG; BILGLASS; 891655312; 29774
Bilbutikken AS; Sundlandveien 3; 3005; DRAMMEN; BILVERKSTED01, KONTROLLORGAN01; 986351655; 3624
Sulland Tromsø AS; Alkevegen 12; 9015; TROMSØ; BILVERKSTED01B, KONTROLLORGAN01B; 860152002; 9513
Berres  Bil og Båt  AS; Ramberg; 8380; Ramberg; BILVERKSTED01B, KONTROLLORGAN01B; 925021245; 9280
MITT VERKSTED AS; Sandalsringen 3; 5225; NESTTUN; BILVERKSTED01, HJUL, KONTROLLORGAN01; 996234150; 19960
Autoskade Bærum AS; Lommedalsveien 281; 1350; Lommedalen; BILSKADE; 987778318; 972
TECH-SERVICE AS; Heggstadmyra 15; 7080; HEIMDAL; LYSUTSTYR, HENGERESPALOPSBREMSEANLEGG; 916617496; 30071
Senter Landbruksverksted A/S; Engsmyrveien 21, Pb. 40; 1740; Borgenhaugen; LYSUTSTYR, HENGERESPALOPSBREMSEANLEGG; 918412360; 180
Jæger Sentrum as; Kokstadveien 42B; 5257; KOKSTAD; BILVERKSTED01, BILSKADE, KONTROLLORGAN01; 976070097; 6510
VANSE DEKKSERVICE V/ ANDREAS KOLNES; DYNGVOLLVEIEN 194; 4560; VANSE; HJUL; 984553889; 30689
Bilhallen AS; Kongsgård alle 64B; 4632; Kristiansand; BILVERKSTED01, KONTROLLORGAN01, BILSKADE; 981447867; 5729
Varhaug Servicesenter AS; Varhaugvn 17; 4360; VARHAUG; BILVERKSTED01B, KONTROLLORGAN01B; 986931627; 16540
HARALD FAGERENG'S GARAGE; FREDLY; 8186; TJONGSFJORDEN; HJUL; 994155830; 30863
FØRDE BILSERVICE AS; FLOVEGEN 6; 6800; FØRDE; BILVERKSTED01, KONTROLLORGAN01; 922625263; 7025
Korsbakken Auto AS; Plogjons veg 55; 2334; ROMEDAL; BILSKADE; 991461426; 16539
SNAP DRIVE TILLER AS; Østre Rosten 76; 7075; TILLER; BILVERKSTED01, KONTROLLORGAN01; 971585188; 8072
Thor Yngvar Hellingsrud Bil og Vedlikehold; Tjøllingveien 570; 3280; TJODALYNG; BILVERKSTED01, KONTROLLORGAN01; 990790175; 10033
KENNETH ARNESEN BILVERKSTED AS; KJÆSEGGVEIEN 100; 1859; SLITU; BILVERKSTED01, KONTROLLORGAN01; 917151784; 30094
TECH'S AS; FINNMARKSVEIEN 50; 9600; HAMMERFEST; KONTROLLORGAN01B, BILVERKSTED01B; 989649604; 28323
Trigger Jobb A/S; Bakarvågen 15; 5305; FLORVÅG; BILVERKSTED01; 957401295; 19220
Kodal Bil; Svartsrødvn.1; 3243; KODAL; BILVERKSTED01; 982304865; 4742
Style Auto A/S; Svarthagsveien 2; 1543; VESTBY; BILVERKSTED01, KONTROLLORGAN01; 937566794; 777
TEKNISK BUREAU BARDUFOSS AS; Haraldvollvegen 2; 9325; Bardufoss; BILVERKSTED01B, KONTROLLORGAN01B; 951738808; 9817
Bilskaden; Industriveien 31; 7080; HEIMDAL; BILSKADE; 991187006; 11510
MJØSBIL AS AVD DOKKA; Vest-Torpvegen 2; 2870; DOKKA; HJUL; 971825588; 29864
VEGGLI BIL OG FRITID AS; NUMEDALSVEGEN 5820; 3628; VEGGLI; KONTROLLORGAN01, BILVERKSTED01; 916482361; 30472
Mjøsbil AS avd. Lillehammer; Korgveien 40; 2619; LILLEHAMMER; MOTORSYKKELOGMOPED, KONTROLLORGAN01B, BILVERKSTED01B; 950223243; 15578
DEKKMESTEREN AS avd Berger; Bølerveien 38 Berger; 2016; FROGNER; HJUL; 999325882; 30774
SENTRUM MOTOR AS; Øravegen 18; 6650; Surnadal; BILVERKSTED01, KONTROLLORGAN01; 981195418; 7876
MÅLSELV BILDIAGNOSE VIDAR JENSSEN; MÅLSNESVEIEN 742; 9321; MOEN; BILVERKSTED01; 916709854; 30848
YTRE NAMDAL VERKSTEDSENTER AS; Lissbjørknesvegen 78; 7970; KOLVEREID; KONTROLLORGAN04, BILVERKSTED02, BILVERKSTED03, BILVERKSTED01, FARTSSKRIVER; 915513794; 29368
Trucknor Haugesund A/S; Raglamyrvegen 32; 5509; Haugesund; FARTSSKRIVER, BILVERKSTED02, BILVERKSTED03, PABYGGER, KONTROLLORGAN04, ALKOLASVERKSTED; 975941337; 6452
Team Verksted Øst  AS, avd. Hadeland; Jarenvegen 65; 2770; JAREN; FARTSSKRIVER, BILVERKSTEDALLE, KONTROLLORGAN04, ALKOLASVERKSTED; 989460072; 23200
Boreal Buss AS avd Verksted Hammerfest; Rossmollgata 86; 9600; HAMMERFEST; FARTSSKRIVER, BILVERKSTED01, BILVERKSTED02, BILVERKSTED03, KONTROLLORGAN04; 979437218; 9653
MC-SENTERET KRISTIANSAND; DRONNINGENSGT 59; 4608; KRISTIANSAND S; MOTORSYKKELOGMOPED; 981135474; 5611
Norsk Scania AS, avd Stavanger; Fosseikevegen 16; 4323; SANDNES; FARTSSKRIVER, BILVERKSTED02, BILVERKSTED03, PABYGGER, KONTROLLORGAN03, ALKOLASVERKSTED; 879263662; 5992
Tid For Service AS; Røysumvegen 5; 3801; BØ I TELEMARK; BILELEKTRODRIVSTOFFANLEGG, MOTORSYKKELOGMOPED, EKSOSANLEGG, HENGERESPALOPSBREMSEANLEGG, HJUL, LYSUTSTYR; 922937133; 31275
BUSKERUD KAROSSERI AS; TEGLVERKSVEIEN 21; 3057; SOLBERGELVA; BILSKADE; 923723536; 31414
SOGN BIL & BÅT AS; HAGANE 3; 6863; LEIKANGER; BILVERKSTED01B, BILVERKSTED02, KONTROLLORGAN01B, KONTROLLORGAN04, BILVERKSTED03, TRAKTOR, FARTSSKRIVER; 919486791; 30535
Toyota Sulland Lillehammer AS; Lagervegen 1; 2619; LILLEHAMMER; BILVERKSTED01, KONTROLLORGAN01; 979155204; 2612
Vianor AS, avdeling Leangen; Leangen Alle 8; 7044; TRONDHEIM; BILVERKSTED01, BILDIESEL, KONTROLLORGAN01, HJUL; 935429447; 24462
TORES AUTO SPELHAUGEN AS; KROKATJØNNVEIEN 11; 5147; FYLLINGSDALEN; KONTROLLORGAN01, BILVERKSTED01; 915680275; 29651
BILSERVICE SKEDSMO AS; INDUSTRIVEIEN 4D; 2020; SKEDSMOKORSET; BILVERKSTED01, KONTROLLORGAN01; 921151527; 30931
CC-GLASS TØNSBERG AS; TRÆLEBORGODDEN 2; 3112; TØNSBERG; BILGLASS; 997238419; 28340
HALDEN DEKK AS; KNIVSØVEIEN 4; 1788; HALDEN; HJUL; 948567121; 31255
MITT DEKKHOTELL KOKSTAD AS; KOKSTADFLATEN 40; 5257; KOKSTAD; HJUL; 919430729; 30663
DEKKCENTERET BERGEN AS; Tellnes Næringspark 28; 5357; FJELL; HJUL; 985737614; 29819
Autobuss AS; Pancoveien 30; 1624; GRESSVIK; PABYGGER, FARTSSKRIVER, ALKOLASVERKSTED; 912788652; 27901
Biltrend Tromsø   AS; Solstrand; 9020; TROMSDALEN; BILVERKSTED01B, MOTORSYKKELOGMOPED, KONTROLLORGAN01B; 947782959; 9520
Lyngdal Karosseri & Auto AS; Grøndokkmoen 22; 4580; Lyngdal; KONTROLLORGAN04, BILVERKSTEDALLE, FARTSSKRIVER, KONTROLLORGAN01B, ALKOLASVERKSTED; 914060370; 5767
ULSTEIN BIL A/S; Høddvegen 20; 6065; ULSTEINVIK; BILVERKSTED01, MOTORSYKKELOGMOPED, KONTROLLORGAN01, BILSKADE, BILVERKSTED01B, KONTROLLORGAN01B; 943815593; 7542
BJØRKLUND MEK VERKSTED AS; STEINBEKKHAUGV 54; 8610; MO I RANA; PABYGGER; 877029522; 29918
Toyota Sulland Kongsvinger AS; Industrivegen 39; 2202; Kongsvinger; BILVERKSTED01, BILSKADE, KONTROLLORGAN01; 929035445; 2486
JÆGER  Automobil as; Kanalveien 111; 5068; BERGEN; BILSKADE, BILVERKSTED01, KONTROLLORGAN01; 839280882; 6538
Scan Parts AS; Ingvald Ystgaards vei 13B; 7047; TRONDHEIM; BILVERKSTED01, KONTROLLORGAN01; 982730694; 12273
ELVERUM  BIL OG DEKK  AS; Torggata 3, Amfi Elverum; 2408; Elverum; BILVERKSTED01, KONTROLLORGAN01; 983777864; 2248
DEKKMANN AS AVD OPPDAL 5836; Ola Setroms veg 43; 7340; OPPDAL; HJUL, BILVERKSTED01; 974292904; 29562
Bil-Service personbiler AS, avd. bruktbil Ramdal; Ramdalveien 4; 3128; NØTTERØY; BILVERKSTED01; 975933601; 31411
BØ GLASS AS; STASJONSVEGEN 31C; 3800; BØ I TELEMARK; BILGLASS; 913565126; 30793
Starco Norge AS; Breivollveien 27; 0668; OSLO; HJULUTRUSTNING; 934531345; 18659
NORBIL AS; RUNDHÅGEN 6; 9409; HARSTAD; BILVERKSTED01B, KONTROLLORGAN01B; 915566944; 29299
RIIS MONTASJE AS; Liamyrene 2; 5132; NYBORG; BILGLASS; 921979436; 29284
JOMA INDUSTRISERVICE AS; JOMA; 7898; LIMINGEN; BILVERKSTED01B; 976585186; 30474
SVENDSEN BILVERKSTED FRANK ARILD HINDERAKER-SVENDSEN; POSTVEGEN 52; 4280; SKUDENESHAVN; KONTROLLORGAN01B, BILVERKSTED01B; 921366914; 30936
BERTEL O. STEEN BERGEN AS - NYBORG; LIAMYRANE 5; 5132; NYBORG; HJUL; 910116851; 30741
TH MOTOR AS; SANDSVÆRVEIEN 85; 3616; KONGSBERG; HJUL, BILGLASS; 918034463; 30414
STRYN MEK VERKSTED AS; LANGESET; 6783; STRYN; BILSKADE, BILVERKSTED01B, KONTROLLORGAN01B; 920450806; 30739
Skaarn's Elektro og Dekkservice ANS; Storgata 30; 8480; ANDENES; HJUL; 985668353; 29737
Karmøy Bilservice AS; Stongsvingen 70; 4270; ÅKREHAMN; BILVERKSTED01, KONTROLLORGAN01, BILVERKSTED01B, KONTROLLORGAN01B; 974444186; 6450
MOSS HAGEMASKINSERVICE AS; VARNAVEIEN 41; 1526; MOSS; LYSUTSTYR, HENGERESPALOPSBREMSEANLEGG; 994263595; 31480
Auto Konsult Trondheim AS; Øvre Flatåsveg 6; 7079; Flatåsen; BILVERKSTED01, KONTROLLORGAN01; 985483515; 8119
IVAR NERVIK AS; Idrettsvn. 4 B; 7072; HEIMDAL; BILVERKSTED01, BILSKADE; 970246185; 8216
Altombil AS; Øyjordveien 53; 8519; NARVIK; BILVERKSTED01B, KONTROLLORGAN01B; 997275764; 19879
VIANOR AS avd 16 Lillestrøm; Leiraveien 15; 2000; LILLESTRØM; BILVERKSTED01, KONTROLLORGAN01; 935429447; 16359
Norsk Scania AS, avd Buss Arendal; Moland Park- Arendal; 4846; ARENDAL; BILVERKSTEDALLE, FARTSSKRIVER, KONTROLLORGAN04; 879263662; 28151
Rana Karosseri; Saltfjellveien 14; 8613; MO I RANA; BILSKADE; 987771003; 8908
BILSKADESENTERET NORDFJORD AS; HEGREVEGEN 1; 6783; STRYN; BILSKADE; 919829249; 30657
Norsk Scania AS avd. Narvik; Fagernesveien 145; 8514; Narvik; FARTSSKRIVER, BILVERKSTED02, BILVERKSTED03, TRAKTOR, KONTROLLORGAN04, ALKOLASVERKSTED; 879263662; 9204
STIANS BILGLASS AS; HØNENGATA 65; 3515; HØNEFOSS; BILGLASS; 915607322; 29457
SKAUN BENSINSTASJON M HUSBY; SKAUN; 7357; SKAUN; HJUL; 923976272; 29727
Andresen Askim; Rakkestadveien 2; 1814; ASKIM; BILVERKSTED01B, KONTROLLORGAN01B, ALKOLASVERKSTED; 911749963; 247
CHRISTENSEN BILLAKKERING; HANS HANSENS VEI 133; 3022; DRAMMEN; BILGLASS; 988810568; 29664
TITRAN BIL OG DEKKSERVICE PAUL ANDRE RØD MELAND; Nordfrøyveien 234; 7260; SISTRANDA; HJUL; 897019752; 29789
A-K Maskiner AS avd. Tynset; Elvegaten 9C; 2500; TYNSET; TRAKTOR; 946468037; 19541
Suldal Billakkering avd.Ølen Auto; Mulagata 38; 5580; ØLEN; BILVERKSTED01, KONTROLLORGAN01; 922261083; 27661
GAULAR BIL AS; BYGSTADVEGEN 89; 6973; SANDE I SUNNFJORD; BILVERKSTED01, KONTROLLORGAN01; 919206039; 30481
AUTOGLASS AS; Liamyrene 6; 5132; NYBORG; BILGLASS; 968552732; 29377
AUTOGLASS TRONDHEIM AS; Tempeveien 35; 7031; TRONDHEIM; BILGLASS; 923319298; 29384
M.R AUTOHAWK AS; KAKKELOVNSKROKEN 2; 0954; OSLO; HJUL; 920319297; 30944
Brennes Auto AS; Klokkergårdveien 9; 1711; SARPSBORG; BILVERKSTED01, KONTROLLORGAN01, BILSKADE; 851482652; 145
ALBJERK BIL DRAMMEN A/S; ING. RYBERGSGT. 100; 3027; DRAMMEN; BILVERKSTED01, KONTROLLORGAN01; 983222870; 3677
Felleskjøpet Agri SA avd. Klett; Heimdalsveien 213; 7083; LEINSTRAND; TRAKTOR; 911608103; 19301
HATLANE AUTOSERVICE AS; BORGUNDVEGEN 549; 6016; ÅLESUND; EKSOSANLEGG, HENGERESPALOPSBREMSEANLEGG, HJUL, LYSUTSTYR; 979126050; 29971
ÅNDALSNES BILVERKSTED AS; Øran Vest; 6300; ÅNDALSNES; BILVERKSTED01B, KONTROLLORGAN01B; 943559775; 7605
Felleskjøpet Agri SA, Bergen; Nordre Brurås 5; 5131; NYBORG; TRAKTOR; 911608103; 19423
Alex Autoservice AS; Vollsveien 74; 1358; JAR; BILVERKSTED01, KONTROLLORGAN01; 990050244; 986
LINKJENDAL BILFORRETNING A/S; Gamle Sørlandske 74; 3766; SANNIDAL; BILVERKSTED01, BILSKADE, KONTROLLORGAN01; 932728982; 4855
FAUSKE GLASS & RAMME AS; HÅNDVERKSVEIEN 8; 8200; FAUSKE; BILGLASS; 947495739; 28353
Mobile Førde AS; STEINAVEGEN 8; 6804; FØRDE; BILVERKSTED01, KONTROLLORGAN01; 991075968; 7060
Borgedal Bilservice AS; Tromsnesvegen 79; 2634; FÅVANG; BILVERKSTED01B, KONTROLLORGAN01B; 892897352; 13461
Helges Bil AS; Dahlemoen 25; 2670; Otta; FARTSSKRIVER, BILVERKSTEDALLE, PABYGGER, KONTROLLORGAN04; 859965962; 2820
YAMAHA SENTERET LØVOLD AS; TOLDER HOLMERS VEI 6; 8003; BODØ; HJUL, MOTORSYKKELOGMOPED, HENGERESPALOPSBREMSEANLEGG; 994952145; 30144
ISEVEIEN SERVICES AS; Bredmyra 9; 1739; BORGENHAUGEN; PABYGGER, FARTSSKRIVER, ALKOLASVERKSTED; 912569586; 28171
HØGLUNDS DEKKSERVICE AS; INDUSTRIVEGEN 2; 2120; SAGSTUA; HJUL; 919217146; 30733
NOTODDEN BILGLASS AS; SEMSVEIEN 36; 3673; NOTODDEN; BILGLASS; 995159104; 29253
BILGUMMILAGERET AS; BYGNES; 4250; KOPERVIK; HJUL; 993098647; 29288
Lastebilsenteret AS; Moen industriområde 38; 3623; KONGSBERG; BILVERKSTED01B, BILVERKSTED02, BILVERKSTED03, KONTROLLORGAN04; 987554703; 3794
Felleskjøpet Agri SA avd. Brekstad; Havnegaten 2; 7130; BREKSTAD; TRAKTOR; 911608103; 19341
Bilservice Vest AS; Idrettsveien 128  Straume Næringspark; 5353; STRAUME; BILVERKSTED01B, KONTROLLORGAN01B; 994391151; 14938
BILSERVICE SANDVIKA AS; Industriveien 25; 1337; SANDVIKA; BILVERKSTED01, KONTROLLORGAN01; 918353046; 30285
RSA Bil Arendal; Kystveien 244; 4841; ARENDAL; BILVERKSTED01B, KONTROLLORGAN01B; 915518389; 5321
Ryds Bilglass Rogaland AS; Åvegen 2; 4100; JØRPELAND; BILGLASS; 989204068; 29678
Bavaria Romerike AS avd Lillestrøm; C. J. Hansens vei 15; 2007; KJELLER; BILVERKSTED01, KONTROLLORGAN01; 960804953; 1009
Transrep AS; Haraldrudveien 22; 0581; OSLO; PABYGGER; 984937482; 1659
Treco - Bil AS; Heglandsvegen 51; 5680; TYSNES; BILVERKSTED01, KONTROLLORGAN01; 948569175; 6773
Per Tverfjell Bilomsetning AS; Løkenvegen 2; 6422; Molde; BILVERKSTED01, MOTORSYKKELOGMOPED, KONTROLLORGAN01; 957763812; 7601
Rolvsøy Bilverksted Arne Wiese-Hansen; Sivløkka 8; 1664; Rolvsøy; BILVERKSTED01; 957696120; 338
AUTOSTRADA ARENDAL AS; Åsbieveien 58  ; 4847; ARENDAL; BILVERKSTED01, KONTROLLORGAN01; 952671162; 5326
DEKKPROFF AS avd Bærum; Johs Haugeruds vei 20; 1351; RUD; HJUL; 916725558; 31289
AS Auto Askim; Sagveien 9; 1814; ASKIM; BILVERKSTED01, KONTROLLORGAN01; 910355228; 201
Pedersens Varmeservice AS; Myggveien 14; 9514; ALTA; BILVERKSTED01B, KONTROLLORGAN01B; 984318286; 19820
SULLAND FREDRIKSTAD FORD; Smørbøttaveien 11; 1617; FREDRIKSTAD; BILVERKSTED01B, KONTROLLORGAN01; 911352400; 30704
NAMDAL GLASSERVICE AS; PINAVEGEN 2A; 7800; NAMSOS; BILGLASS; 941883680; 28336
Bertel O. Steen Trøndelag AS; Tiltaksveien; 7300; ORKANGER; BILVERKSTED01, KONTROLLORGAN01; 915254209; 8345
Utne Transport AS; Statsminister Torpsvei 49; 1738; BORGENHAUGEN; BILVERKSTED03, KONTROLLORGAN03; 920118895; 27401
Humberset Bil-og Mek Verkstad A/S; Hamnegata 37; 6100; Volda; BILVERKSTED01B, MOTORSYKKELOGMOPED, KONTROLLORGAN01B, BILVERKSTED01, KONTROLLORGAN01; 930552356; 7506
Farstads Motorservice AS; Øvre vei 25; 6415; Molde; MOTORSYKKELOGMOPED; 918434070; 7661
BODAHL-JOHANSEN AS avd MYSEN; Ramstadveien 13; 1850; MYSEN; HJUL; 965308032; 28537
FØRDE BILSALG AS; ØYRANE 1; 6800; FØRDE; BILVERKSTED01, KONTROLLORGAN01; 912098923; 28235
VIANOR AS avd Haugesund; Raglamyrvegen 11; 5536; HAUGESUND; BILVERKSTED01B, KONTROLLORGAN01B, KONTROLLORGAN01, BILVERKSTED01; 935429447; 24540
IVARS BIL; Grandmarka 192; 7670; Inderøy; BILVERKSTED01; 857574222; 8648
HØYLANDET AUTO AS; Salhussletta 4; 8900; Brønnøysund; BILVERKSTED01, KONTROLLORGAN01; 987739231; 8800
Bil i Nord AS avd. Mazda; Mjånesveien 1; 8370; LEKNES; BILVERKSTED01B, KONTROLLORGAN01B; 983666280; 31372
Bilskadesenteret Telemark AS; Raset 69; 3735; Skien; BILSKADE, BILVERKSTED01; 986658645; 4909
Autoteknikk Ryen AS; Ryensvingen 11; 0680; OSLO; KONTROLLORGAN01, BILVERKSTED01; 912063038; 27121
Agder Karosseri AS; Grøm Næringspark 15; 4887; GRIMSTAD; BILVERKSTED01, KONTROLLORGAN01; 913079221; 27042
BERGHEIM MASKIN AS; SPIKERMOEN; 2900; FAGERNES; KONTROLLORGAN01, TRAKTOR, BILVERKSTED01; 990977550; 31239
Owren AS; Paul A. Owrens veg 30; 2607; VINGROM; PABYGGER; 998415500; 27502
MEKONOMEN SERVICES AS avd. Rasta; Lerkevegen 52; 2209; KONGSVINGER; BILVERKSTED01, KONTROLLORGAN01; 999323332; 31009
Bilia Lillehammer; Korgvegen 25; 2619; LILLEHAMMER; BILVERKSTED01, KONTROLLORGAN01; 976023188; 2615
LIER DEKK OG FELG AS; GJELLEBEKKSTUBBEN 21; 3420; LIERSKOGEN; HJUL; 944726691; 30328
LANGSHOLT GLASS SERVICE AS; SNEKKERSTUBAKKEN 24; 1738; BORGENHAUGEN; BILGLASS; 998539080; 29479
Automote bil og deler Kai Løberg; Hystadv. 188; 3209; SANDEFJORD; BILVERKSTED01; 962367038; 4719
MATHISENS LANDBRUKSSERVICE AS; ALTAVEIEN 269; 9515; ALTA; KONTROLLORGAN01B, BILVERKSTED01B, TRAKTOR; 992040491; 29471
Frydenbø Bilsenter Kristiansand AS; Barstølv. 40 ; 4636; KRISTIANSAND S; BILVERKSTED01, KONTROLLORGAN01; 967149098; 5615
NYE SKOG OG HAGE AS; Storgata 106, 2390 Moelv; 2624; LILLEHAMMER; MOTORSYKKELOGMOPED, HENGERESPALOPSBREMSEANLEGG; 994931083; 31178
Hesby Auto AS; Hesby; 4160; FINNØY; BILVERKSTED01B, KONTROLLORGAN01, TRAKTOR, BILSKADE; 922393583; 6122
STJØRDAL BILGLASS AS; VÆRNESGATA 9; 7503; STJØRDAL; BILGLASS; 992848170; 28396
Lillo Bil og Landbruksverksted; Lillestrømv. 968; 1912; ENEBAKK; BILVERKSTED01; 970303898; 1028
RAMSENGS  AUTO AS; Ranenget 6; 8626; Mo i Rana; BILVERKSTED01B, KONTROLLORGAN01B; 977168554; 8915
Skien Bilrestaurering; Skotfossvegen 275; 3720; SKIEN; BILVERKSTED01; 985159696; 4885
RASTA GLASS AS; EIDSKOGVEGEN 46; 2211; KONGSVINGER; BILGLASS; 939357777; 28420
Bavaria Molde AS; Hendenvegen 3; 6423; MOLDE; BILVERKSTED01, KONTROLLORGAN01; 980743039; 7630
GRAND AUTOSERVICE AS; BRÅDALSSTUBBEN 1-3; 1481; HAGAN; BILVERKSTED01, KONTROLLORGAN01; 913826302; 29079
Lierskogen Bil AS; Drammensveien 267; 3420; LIERSKOGEN; BILVERKSTED01, KONTROLLORGAN01; 987105240; 3795
Mårvik Bilverksted; Nordslettvegen 2; 7038; TRONDHEIM; BILVERKSTED01, KONTROLLORGAN01; 997534743; 20341
Røros kommune verksted; Stamphusveien 27; 7374; RØROS; BILVERKSTED01B, KONTROLLORGAN01B; 939898743; 8393
Solstad MC service; Kårli; 7105; STADSBYGD; MOTORSYKKELOGMOPED; 990539871; 10290
Bertel O. Steen Rogaland AS (skade); Vassbotnen 9 Forus; 4069; STAVANGER; BILSKADE; 912771784; 18459
STOKMARKNES AUTOSENTER AS; INDUSTRIVEIEN 2; 8450; STOKMARKNES; HJUL; 912461211; 30768
BRUMUNDDAL AUTO-REP.; Strandveien 12 C; 2380; Brumunddal; BILVERKSTED01, MOTORSYKKELOGMOPED, BILSKADE, KONTROLLORGAN01; 971160586; 2039
DEKKHALLEN AS; BJERKELUNDSVEIEN 18; 1358; JAR; HJUL; 996239535; 28476
Lena Maskin AS, avd. Rudshøgda; Leinskogen 5; 2360; RUDSHØGDA; TRAKTOR; 941263003; 17879
SS Automobil verksted A/S; Strandgata 143; 6060; Hareid; BILVERKSTED01B, KONTROLLORGAN01B; 981600800; 7559
Gjermundsen Auto AS - Larvik; Elveveien 216; 3271; LARVIK; BILVERKSTED01, KONTROLLORGAN01; 928108325; 4615
DEKKTEAM AS; Fokserødveien 30 - 3241 Sandefjord; 3241; SANDEFJORD; HJUL; 870897332; 29878
Leif Gromstad Auto AS; Vesterveien 56 ; 4839; ARENDAL; BILVERKSTED01B, BILSKADE, KONTROLLORGAN01B; 914031923; 5344
Kvinesdal Lakk & Skade AS; Industrigt 35; 4480; KVINESDAL; BILSKADE, KONTROLLORGAN01, BILVERKSTED01; 886699492; 27022
BRØDRENE LER AS; ØSTRE ROSTEN 78A; 7075; TILLER; TRAKTOR; 980376125; 30910
Sunnhordland Bil  AS; Vabakkjen 8; 5411; STORD; BILVERKSTED01B, KONTROLLORGAN01B; 981136098; 6767
Huftarøy Auto A/S; Sandvik; 5392; STOREBØ; BILVERKSTED01B, KONTROLLORGAN01B; 843433502; 6768
Bil-Service Personbiler AS  Sandefjord; Nygårdsveien 79; 3221; SANDEFJORD; BILVERKSTED01B, KONTROLLORGAN01; 975933601; 4715
HANS IVAR SLÅTTØY TRANSPORT AS; Bekkeidet; 8920; SØMNA; PABYGGER, HJUL; 985346216; 29875
TELLNES AUTOSENTER AS; TELLNES NÆRINGSPARK 28; 5357; FJELL; KONTROLLORGAN04, BILVERKSTED03, BILVERKSTED02, TRAKTOR, BILVERKSTED01B, BILSKADE, MOTORSYKKELOGMOPED; 916334354; 29973
DEKK1 avd. Stavanger; Dalsetveien 2 E; 4018; STAVANGER; HJUL, HENGERESPALOPSBREMSEANLEGG; 979579292; 29003
NORDVIK AS avd. Bilskade; Olav V gt. 104; 8004; BODØ; BILSKADE; 946549770; 31299
TEAM VERKSTED TRØNDELAG AS, avd. Levanger; Gråmyrvegen 43; 7608; LEVANGER; BILVERKSTEDALLE, KONTROLLORGAN04, HJUL; 930462640; 30913
Narvik Bilutstyr; Industriveien 20; 8501; Narvik; BILVERKSTED01, MOTORSYKKELOGMOPED; 936589510; 9219
MÅNDALEN SERVICESENTER AS; SØRSIDEVEGEN 1769; 6386; MÅNDALEN; HJUL; 947847481; 30107
BIL OG BOBIL ØSTERHUS AS; INDUSTRIVEIEN 25; 4879; GRIMSTAD; BILVERKSTED01B, KONTROLLORGAN01B; 919510315; 30671
WANGEN LAKK OG KAROSSERI; Nuggursvegen 220; 2219; BRANDVAL; BILSKADE; 982940206; 29449
Digre Bilverksted; Holmejordetveien 18; 3267; LARVIK; BILVERKSTED01, KONTROLLORGAN01; 913795083; 27801
Kjell Strømme A/S Bilforretning; MARVIKSVN 103; 4632; KR.SAND; BILVERKSTED01, KONTROLLORGAN01; 825706992; 5668
VANG AUTO AS; Vindholvegen 1; 2324; Vang Hedm.; KONTROLLORGAN01B, BILVERKSTED01B; 993763454; 2057
Nordic Last og Buss AS avd. Sortland; Verkstedveien 4; 8400; Sortland; FARTSSKRIVER, BILVERKSTED01, BILVERKSTED02, BILVERKSTED03, TRAKTOR, KONTROLLORGAN04, ALKOLASVERKSTED; 979463332; 9332
