KLYPA BIL AS; KLYPAVEIEN 28; 1894; RAKKESTAD; BILSKADE, BILGLASS; 922694028; 31343
Funnemark AS - avd. Kongsberg; Kobberbergsveien 6; 3615; KONGSBERG; BILVERKSTED01, KONTROLLORGAN01; 911876493; 24163
TESLA MOTORS NORWAY AS AVD. STAVANGER; Vestre svanholmen 13; 4313; SANDNES; BILVERKSTED01; 914193141; 29014
KAUPANGER BIL AS; Kvernhushagen 1; 6854; KAUPANGER; BILVERKSTED01, KONTROLLORGAN01; 987102209; 7232
MELDAL BILLAKKERING; VÅGAVEGEN 414A; 7670; INDERØY; BILGLASS, HJUL, BILVERKSTED01, KONTROLLORGAN01; 912398064; 30320
DRØBAK BILGLASS AS; OSLOVEIEN 65; 1443; DRØBAK; BILGLASS, HJUL; 993014664; 28400
Hammerfest Auto AS; Fjordaveien 36; 9610; Rypefjord; BILVERKSTED01B, KONTROLLORGAN01B; 926418084; 9658
SKI SKADE OG LAKK AS; KRÅKSTADVEIEN 90; 1424; SKI; BILSKADE; 912392783; 30858
BILCO HØNEFOSS A/S; Asbjørnsens gate 19; 3513; HØNEFOSS; BILVERKSTED01, KONTROLLORGAN01; 966109327; 3323
Auto - Skade Terje Schie AS; Haralds vei 15; 1470; LØRENSKOG; BILSKADE; 994837818; 12792
STENEBRÅTEN-BIL AS; Mosseveien 13; 1610; FREDRIKSTAD; BILSKADE; 996501442; 28488
Bertel O. Steen AS avd. Arendal; Postboks 1528 Stoa; 4856; ARENDAL; FARTSSKRIVER, BILVERKSTEDALLE, KONTROLLORGAN04, ALKOLASVERKSTED; 913206150; 22841
TRETTEMO VERKSTEDDRIFT AS; TRETTEMOVEGEN 126; 2056; ALGARHEIM; BILVERKSTED03, TRAKTOR, FARTSSKRIVER; 999041000; 29622
BÅT & TILHENGERSERVICE AS; PARADISVEIEN 23; 4012; STAVANGER; HENGERESPALOPSBREMSEANLEGG, LYSUTSTYR; 998570840; 29433
Saint-Gobain Autover Norge AS avd. Bergen; Møllendalsveien 1; 5009; BERGEN; BILGLASS; 918276785; 30278
MIKKELRUD BIL AS; INDUSTRIVEIEN 1; 1640; RÅDE; BILVERKSTED01; 998398517; 30852
Robergs Auto AS; Meierigaten 2; 3915; TØNSBERG; BILVERKSTED01, KONTROLLORGAN01; 914251796; 28912
Lomoen Bil AS; Handelsveien 9; 2640; VINSTRA; BILVERKSTED01, MOTORSYKKELOGMOPED, KONTROLLORGAN01; 983241824; 2835
Rakkestad Autosenter AS; Industriveien 9; 1890; RAKKESTAD; BILVERKSTED01B, KONTROLLORGAN01B; 990468184; 16798
FLATANGER MOTOR AS; Storlavika 10; 7770; Flatanger; BILVERKSTED01; 971207558; 8732
Team Verksted Nord AS avd. Bjerka; Strandgata 12; 8643; BJERKA; FARTSSKRIVER, BILVERKSTED02, BILVERKSTED03, TRAKTOR, KONTROLLORGAN04; 976891783; 25881
Jensens Bilservice AS; Enebakkveien 131; 0680; OSLO; BILVERKSTED01, KONTROLLORGAN01; 997898508; 24781
AUTOSPESIALISTEN TØNSBERG AS; TRÆLEBORGVEIEN 5; 3112; TØNSBERG; KONTROLLORGAN01B, BILSKADE, BILVERKSTED01B; 918583343; 30366
Felleskjøpet Agri SA; Husøynvegen; 3550; GOL; TRAKTOR; 911608103; 19559
Molde Billakkering AS; Årøsetervegen 7; 6422; MOLDE; BILSKADE; 961763991; 7688
Lillestrøm Bilservice AS; Odalsgata 29; 2000; LILLESTRØM; BILVERKSTED01, KONTROLLORGAN01; 997986008; 27162
Larsnes Auto A/S; Halleskifte; 6084; Larsnes; BILVERKSTED01B, KONTROLLORGAN01B; 970922520; 7502
CARGLASS AS; Olav V gate 102; 8004; BODØ; BILGLASS; 985758220; 29371
Westrum AS; Øvermarka 2; 2327; FURNES; PABYGGER; 986523081; 21240
PRO MOTOR NORD AS; Snev. 11; 8072; BODØ; BILVERKSTED01, MOTORSYKKELOGMOPED, BILSKADE; 986651101; 9084
CARGLASS AS AVD TUNGA; Tungasletta 12; 7047; TRONDHEIM; BILGLASS; 822639682; 31221
AE Motor og Bilservice AS; Markveien 53; 9510; ALTA; BILVERKSTED01, KONTROLLORGAN01; 996030830; 17319
TRØNDER TAXI AS; Brøsetvegen 145B; 7069; TRONDHEIM; ALKOLASVERKSTED; 967332550; 31272
Etac Bil AS; Koppholen 19; 4313; SANDNES; BILVERKSTED01, PABYGGER; 999065465; 23320
Norsk Scania AS avd. Sortland; Verkstedveien 1; 8402; SORTLAND; FARTSSKRIVER, BILVERKSTED02, BILVERKSTED03, TRAKTOR, KONTROLLORGAN02, KONTROLLORGAN03; 879263662; 9344
DEKKMANN avd Kristiansand; Skibåsen 42D; 4696; KRISTIANSAND S; HJUL, KONTROLLORGAN01, BILVERKSTED01; 966242825; 28272
HEMNES SLIPEVERKSTED AS; HEMNESVEGEN; 8640; HEMNESBERGET; HJUL; 812843982; 30311
FREDRIKSTAD AUTOCENTER AS; Stabburveien 1; 1617; FREDRIKSTAD; BILVERKSTED01, KONTROLLORGAN01; 997379446; 21780
TOYOTA BILIA ORKANGER; Løypstrengen 14; 7300; ORKANGER; BILSKADE, BILVERKSTED01, KONTROLLORGAN01; 980648915; 8341
Norsk Scania AS, avd. Arendal; Tingstveitveien 4; 4823; NEDENES; FARTSSKRIVER, BILVERKSTEDALLE, KONTROLLORGAN03; 879263662; 5360
Braseth Bil & Motorsport; Kringlavegen 535; 7710; Sparbu; BILVERKSTED01; 988946524; 8675
MAN Truck & Buss AS avd. Drammen; Kobbervikdalen 99 /Boks 654 Strømsø-3003; 3003; DRAMMEN; FARTSSKRIVER, BILVERKSTED01, BILVERKSTED02, BILVERKSTED03, KONTROLLORGAN04, PABYGGER; 824387842; 3764
Erik Nordahl Bilsport; Vearveien 4; 3440; RØYKEN; BILVERKSTED01B, TRAKTOR; 986113746; 24161
Funnemark Hokksund; Sundmoen industriområde; 3300; HOKKSUND; BILVERKSTED01, KONTROLLORGAN01, BILSKADE; 911876493; 24162
Fiskå karosseri A/S; Fiskåbygd; 6143; Fiskåbygd; BILSKADE; 959434115; 7545
Traktorservice AS; Husøyvegen 11; 3550; GOL; BILVERKSTED01B; 955487222; 27601
INTERCAR AS; Andersrudveien 1; 1914; YTRE ENEBAKK; BILVERKSTED01; 919568798; 30782
Bavaria Oslo AS; Økernveien 99; 0579; OSLO; BILVERKSTED01, KONTROLLORGAN01; 976764536; 1304
Bilspesialisten Asker og Bærum A/S; Ringeriksveien 243; 1340; SKUI; BILVERKSTED01, KONTROLLORGAN01; 974629739; 945
HK MASKINSERVICE AS; GAUTVIKVEGEN 1; 6493; LYNGSTAD; BILVERKSTED01; 918276440; 30575
Øksnes Bil & Maskin AS; Storgt. 53; 8430; Myre; BILVERKSTED01B, KONTROLLORGAN01B; 951710814; 9378
Bertel O. Steen Telemark AS; Bedriftsvegen 120; 3735; SKIEN; FARTSSKRIVER, BILVERKSTEDALLE, KONTROLLORGAN04, BILVERKSTED01, KONTROLLORGAN01, ALKOLASVERKSTED; 928140903; 4884
Dombås Bilberging AS; Jora Industriområde; 2660; DOMBÅS; BILVERKSTED01B, KONTROLLORGAN01B; 975996093; 2808
Norsk Scania AS avd. Bodø; Stormyrveien 3; 8008; BODØ; FARTSSKRIVER, BILVERKSTED01, BILVERKSTED02, BILVERKSTED03, KONTROLLORGAN04, ALKOLASVERKSTED; 879263662; 9008
Nordlie Auto AS; Ryggeveien 55; 1523; Høyden/Moss; BILVERKSTED01B, KONTROLLORGAN01B, BILSKADE; 937567200; 506
Squadra Italiana Bilverksted; Smiløkka 6a; 3173; VEAR; BILVERKSTED01, KONTROLLORGAN01; 911957531; 24642
Riis Bilglass Oslo Alnabru Smalvollveien; SMALVOLLVEIEN 63; 0667; OSLO; BILGLASS; 932438658; 28403
HMV Maskin AS ; Regimentsvegen 14; 5705; VOSS; MOTORSYKKELOGMOPED, TRAKTOR; 955098854; 6959
Trucknor Rogaland AS, Egersund; Fossveien 6; 4370; EGERSUND; BILVERKSTED02, BILVERKSTED03; 981925157; 11872
RYDS BILGLASS AS; Osloveien 129; 7017; TRONDHEIM; BILGLASS; 913387783; 30089
RIIS MONTASJE AS; Bjørnstjerne Bjørnsonsgate 122; 3044; DRAMMEN; BILGLASS; 921979436; 30259
Bavaria Haugesund AS; Norevegen 5; 5542; Karmsund; BILVERKSTED01, KONTROLLORGAN01; 990574154; 6481
SKUDENES BENSINSTASJON AS; VEKTARVEGEN 1; 4280; SKUDENESHAVN; BILVERKSTED01; 818308892; 30638
SANDE AUTO  as avd. Mazda; Liamyrane 6; 5132; NYBORG; BILVERKSTED01, KONTROLLORGAN01; 946510939; 6659
Bekk`s Karosseri og Bil; Vålaugsvegen 143; 2032; MAURA; BILSKADE; 848154482; 1233
Brandval dekk  og-bilrekvisita; Goggestredet 4; 2219; Brandval; BILVERKSTED01, KONTROLLORGAN01; 984009852; 2447
EKSOSVERKSTEDET TRONDHEIM AS; SØRENGA 1A; 7032; TRONDHEIM; EKSOSANLEGG, HJUL; 989486519; 29703
OSLO & VIKEN BILSKADESENTER AS; KAKKELOVNSKROKEN 1; 0954; OSLO; BILSKADE; 924739886; 31546
Marnarbil A/S; Bue; 4534; Marnardal; BILVERKSTED01B, TRAKTOR, KONTROLLORGAN01; 818531982; 5752
A-K maskiner AS, avd. Fannrem; Reksteret; 7320; FANNREM; TRAKTOR; 946468037; 19401
Panorama Auto Verksted AS; Floodmyrvegen 14; 3946; PORSGRUNN; BILVERKSTED01; 919001623; 30503
BIL OG LANDBRUK AS; Berggardsmyrvegen 14; 7590; Tydal; BILVERKSTED01, MOTORSYKKELOGMOPED, TRAKTOR, KONTROLLORGAN01; 978680348; 8390
Jans Motorsenter AS; Fossmovegen 2; 1925; BLAKER; BILVERKSTED01, KONTROLLORGAN01; 998442893; 21660
Fagerthun Bil AS; Ankenesveien 7; 8520; ANKENES; BILVERKSTED01, BILSKADE, KONTROLLORGAN01; 962949541; 9211
Transportindustri A/S; Industriveien 9; 8200; Fauske; PABYGGER; 914179785; 9104
Autotech Skien A/S; Risingveien 11; 3716; SKIEN; BILVERKSTED01, BILSKADE, KONTROLLORGAN01; 988177768; 4845
CARAVAN OG BILPLEIE AS; Løding; 8050; TVERLANDET; HJUL; 986568336; 29747
Høylandet Auto AS avd. Namsos; Sivavegen 6; 7820; Spillum; BILVERKSTED01, KONTROLLORGAN01; 912924424; 8711
Møller Øst avd Møller Bil Ryen A/S ; Enebakkveien 154; 0680; OSLO; BILVERKSTED01B, KONTROLLORGAN01B; 917805717; 1334
Tyssedal Bilservice AS; Skjeggedalsvegen 2; 5770; TYSSEDAL; BILVERKSTED01, BILSKADE, KONTROLLORGAN01; 985914656; 6719
Personbil & Varebilservice DA; Vaterlandsveien 35; 3470; SLEMMESTAD; BILVERKSTED01, KONTROLLORGAN01; 982236649; 3760
ELGESETER BILLAKKERING; Vestre Rosten 108; 7075; TRONDHEIM; BILSKADE; 968392875; 8066
SKOTTERUD MOTORSENTER A.S.; Matranvegen 69; 2230; Skotterud; BILVERKSTED01B, KONTROLLORGAN01B; 966812141; 2508
Lillestrøm Bil og Karosseri AS; Skjærvavn. 20; 1466; STRØMMEN; BILSKADE; 942896115; 1127
MOBILE FISKÅTANGEN AS; SVANEDAMSVN 16; 4621; KRISTIANSAND S; BILVERKSTED01, BILSKADE, KONTROLLORGAN01; 918004033; 5725
Wist Last & Buss AS avd. Stjørdal; H.P. Jenssens gt. 5; 7502; STJØRDAL; FARTSSKRIVER, BILVERKSTEDALLE, KONTROLLORGAN04; 958315120; 24941
OmniService AS; Furuveien 8; 1356; BEKKESTUA; BILVERKSTED03, KONTROLLORGAN03; 919424001; 17939
CARAVANSERVICE TANGJERD AS; BØHEIVEGEN 3; 4262; AVALDSNES; HENGERESPALOPSBREMSEANLEGG, LYSUTSTYR; 998845416; 30434
Furnes Bilservice AS; Furnesvikane 1; 6036; MAUSEIDVÅG; BILVERKSTED01B, BILSKADE, KONTROLLORGAN01B; 996170845; 21399
Auto Speed DA Fix Bil; Fanavegen 15; 5221; NESTTUN; BILSKADE; 948474956; 6663
HATLEBERG BIL & MASKIN AS; HYLLESTAD; 6957; HYLLESTAD; BILVERKSTED01, KONTROLLORGAN01; 942831595; 7017
AUTOHJØRNET AS; STASJONSGT. 91; 3300; HOKKSUND; BILVERKSTED01, KONTROLLORGAN01; 988237434; 3969
Tores Auto Loddefjord AS; Lyderhornsveien 291; 5171; Loddefjord; BILVERKSTED01, KONTROLLORGAN01; 977389909; 6674
Felleskjøpet Agri AS avd. Brønnøysund; Gårdsøyveien 5; 8900; BRØNNØYSUND; TRAKTOR; 911608103; 20220
Davincigir AS; Trohaugen Industriområde; 6393; TOMREFJORD; BILVERKSTED01, KONTROLLORGAN01, KONTROLLORGAN01B, BILVERKSTED01B; 997300467; 20379
TELLESBØ KAROSSERI AS; Tellesbø; 6650; Surnadal; BILVERKSTED01B, BILSKADE, KONTROLLORGAN01; 971076690; 7831
SKEVIGS LASTEBILTRANSPORT AS; Hegstadmoen 2; 7080; Heimdal; FARTSSKRIVER, BILVERKSTED01, BILVERKSTED02, BILVERKSTED03, PABYGGER, KONTROLLORGAN04; 915952682; 8092
WERKSTA HADELAND AS; Sørvangsbakken 27; 2770; JAREN; BILVERKSTED01B, BILSKADE; 965893962; 2995
Trysil Bil AS; Vestmovegen 26; 2420; Trysil; BILVERKSTED01, BILSKADE, KONTROLLORGAN01; 843025552; 2200
O. M. GREFSTAD AS; Løkkenveien 175; 7332; LØKKEN VERK; BILVERKSTED01, KONTROLLORGAN01; 912072150; 8311
Bulder Verksted AS, Verksted Tana; Polmakveien 76; 9845; Tana; FARTSSKRIVER, BILVERKSTED01, BILVERKSTED02, BILVERKSTED03, TRAKTOR, KONTROLLORGAN04; 993026352; 9700
GJEVIK BIL AS; Fortunalia 108; 7057; JONSVATNET; HJUL; 970977287; 29731
AS Autoservice; Kusslid; 6800; FØRDE; FARTSSKRIVER, BILVERKSTED01, BILVERKSTED02, BILVERKSTED03, TRAKTOR, KONTROLLORGAN01, KONTROLLORGAN02; 918089861; 7042
Autoin Bilskadesenter AS; Bjørnerudveien 11; 1266; Oslo; BILSKADE; 946171700; 1451
NORDLAND MASKINSENTER AS; SNEVEIEN 13; 8072; BODØ; TRAKTOR; 818417322; 30868
Storøs Auto AS; Salomonsvei 21; 8530; Bjerkvik; BILVERKSTED01, KONTROLLORGAN01; 946093726; 9210
Glåmdal Auto-Rep AS; Otervegen 14; 2211; KONGSVINGER; BILVERKSTED01, KONTROLLORGAN01; 912153916; 25541
ZE-SAM TRAKTOR & MASKIN AS; Melhusveien 397; 7224; MELHUS; TRAKTOR; 923691685; 8041
Automobil 2000 Kristiansand A/S; RIGETJØNNVN 12A; 4626; KR.SAND; BILVERKSTED01, KONTROLLORGAN01; 977320143; 5626
Hegre Auto AS;  Gamleveien 81 ; 4315; SANDNES; BILVERKSTED01, KONTROLLORGAN01, BILSKADE; 937665393; 5926
Service 24 AS  (Torp Bilservice); Roald Amundsensvei 199B; 1659; TORP; BILVERKSTED01, KONTROLLORGAN01; 911970007; 25961
Nye Skotterud Lakk og Karosseri AS; Dalåsen 26; 2230; SKOTTERUD; BILSKADE; 913255712; 26164
LIVERTEN AS; SANDVIKA; 7882; NORDLI; HJUL; 998072433; 29138
Smv / Jim Bogfjellmo; Stabbforsmo; 8680; Trofors; BILVERKSTED01; 969985144; 8807
Bil & Båt Service AS; Hestneselva 1; 8590; Kjøpsvik; BILVERKSTED01, KONTROLLORGAN01; 964096058; 9209
LEVANGER AUTO AS; Ravnsgate 6B; 7600; LEVANGER; BILVERKSTED01B, KONTROLLORGAN01B; 919837098; 30656
Andresen Ski; Åsveien 5; 1400; SKI; BILVERKSTED01B, KONTROLLORGAN01B, FARTSSKRIVER; 911749963; 717
SLETTA SENTER AS; HELLANDSVEGEN 521; 5939; SLETTA; HJUL; 960412370; 30382
TOTEN SERVICESENTER AS; HUNNSELVVEGEN 3; 2830; RAUFOSS; PABYGGER; 917131465; 30205
Kragerø Auto AS Skadeverksted; DALANEVEIEN 13; 3772; KRAGERØ; BILSKADE; 916785887; 31525
Ydersbil v/Erik Ydersbond; Ydersbotn; 1970; HEMNES; BILVERKSTED01, KONTROLLORGAN01; 969255588; 1116
Taugbøl Bil og Maskin AS; Gaupevegen 1A; 2211; KONGSVINGER; BILVERKSTED01, KONTROLLORGAN01; 922927219; 2539
BERTEL O STEEN BUSKERUD AS; Vestre Linnesvei 8; 3401; LIER; BILVERKSTED01B, KONTROLLORGAN01B; 948017539; 30648
Wist Last og Buss AS, avd. Namsos; Navarvegen 10, Spillum; 7820; Namsos; FARTSSKRIVER, BILVERKSTED02, BILVERKSTED03, KONTROLLORGAN04, ALKOLASVERKSTED; 958315120; 8742
ÅRSKOG SERVICE AS; Årskog Industriområde; 5419; FITJAR; HJUL, LYSUTSTYR; 998398738; 30871
Autoservice Mosjøen AS; Mattismoen 5; 8656; Mosjøen; BILSKADE; 913364430; 8853
TUNGEN BIL A/S; Hageveien 15 B; 2613; LILLEHAMMER; BILVERKSTED01, KONTROLLORGAN01; 961345421; 2620
HAUGLI SVERRE BILFORR. A/S; STORGT. 26; 3510; HØNEFOSS; BILVERKSTED01, KONTROLLORGAN01; 912501906; 3394
Sande Dekk- og Utleieservice; Gamle Dalavegen 78; 5600; NORHEIMSUND; HJUL; 920185371; 31385
J/S Serviceteam AS; Grønland 21; 3045; DRAMMEN; BILVERKSTED01; 998283345; 23586
Vianor AS avdeling Økern; Eikenga 29; 0579; OSLO; HJUL; 935429447; 24620
Bil - Vulkan A/S; Ramstadv. 10; 1850; Mysen; HJUL; 927578891; 210
VEVANG AS; STRANDVEGEN 232; 9790; KJØLLEFJORD; BILGLASS; 898177882; 29573
ENGEL DEKK AS; Hauglandsvegen 17; 5310; HAUGLANDSHELLA; HJUL; 918469230; 30417
BODAHL-JOHANSEN AS avd GAMLE FREDRIKSTAD; Habornveien 46; 1630; GAMLE FREDRIKSTAD; HJUL; 965308032; 28538
Volvo Truck Center Gardermoen; Hovinmovegen 18; 2060; GARDERMOEN; FARTSSKRIVER, BILVERKSTEDALLE, KONTROLLORGAN04, ALKOLASVERKSTED; 910712799; 1084
Valle Bil og Maskin AS; Øyne industriveg 19; 4747; VALLE; BILVERKSTED01B, KONTROLLORGAN01; 912177912; 14518
CARGLASS AS avd Askim; Haugomgt 2-4; 1811; ASKIM; BILGLASS; 985758220; 29583
Flisa bil AS; Negardsvegen 8; 2270; Flisa; BILVERKSTED01B, KONTROLLORGAN01B; 836634152; 2476
TRAILERSENTERET AS; MOSTERØYVEIEN 86; 4156; MOSTERØY; BILVERKSTED02, BILVERKSTED03, PABYGGER; 914721032; 29733
THANSEN AS avd MOSS; Varnaveien 43E; 1526; MOSS; HJUL; 923897682; 31466
STRANDVEIEN AUTO STJØRDAL AS; Teglgata 4; 7502; STJØRDAL; BILVERKSTED01, KONTROLLORGAN01; 958648499; 8521
BLAKSTAD AUTO AS; Hellandsjøveien 4; 7200; Kyrksæterøra; BILVERKSTED01B, BILSKADE, KONTROLLORGAN01B; 918058370; 8306
Lena Autoservice AS; Vallevegen 5; 2850; LENA; BILVERKSTED01, KONTROLLORGAN01; 978639240; 2996
O. L. SENTERET AS; Industriveien; 3301; HOKKSUND; BILSKADE; 944174230; 3954
ALVDAL AUTOSERVICE LEIF A WÅLENGEN; Nord-Østerdalsveien 5140; 2560; ALVDAL; HJUL; 980130088; 30201
Frydenbø Bilsenter AS; Haldbrendsøyra 8; 6800; FØRDE; BILVERKSTED01, KONTROLLORGAN01; 967149098; 7092
FERDA BERGEN AS; TELLNES NÆRINGSPARK; 5357; FJELL; HENGERESPALOPSBREMSEANLEGG; 919639466; 31096
GALÅEN TRANSPORT AS; HAVSJØVEIEN NÆRINGSPARK; 7374; RØROS; BILVERKSTED01B, KONTROLLORGAN01B; 978677339; 28256
Sannidal Auto AS; Sannidalsveien 180; 3766; SANNIDAL; BILVERKSTED01, BILVERKSTED02, BILVERKSTED03, KONTROLLORGAN01, KONTROLLORGAN04; 979367201; 4806
GREFSEN AUTO AS; HANS NIELSEN HAUGES GATE 52; 0481; OSLO; BILVERKSTED01, KONTROLLORGAN01; 919461861; 30908
Sulland Kongsvinger AS; Oslovegen ; 2212; KONGSVINGER; BILVERKSTED01B, KONTROLLORGAN01B; 953331896; 2523
DITT SERVICESENTER AS; RYGGEVEIEN 248; 1580; RYGGE; KONTROLLORGAN01, BILVERKSTED01; 918762981; 30953
HAGENS BIL OG KAROSSERIVERK.;  Krøderen; 3535; KRØDERN; BILVERKSTED01, KONTROLLORGAN01; 918913467; 3382
Aslam Bilservice AS; Industrivn.17; 1424; SKI; BILVERKSTED01, KONTROLLORGAN01; 892480532; 713
DEKK1 AS; Hvamsvingen 5; 2013; SKJETTEN; HJUL, HENGERESPALOPSBREMSEANLEGG; 979579292; 30115
Bjørnars Auto Bjørnar B Bull; Grunnfjordveien 1046; 9130; Hansnes; BILVERKSTED01, KONTROLLORGAN01; 922038090; 9577
Snap Drive AS avd. Helsfyr; Grenseveien 80; 0663; OSLO; BILVERKSTED01, KONTROLLORGAN01; 971585188; 1308
Lazy Boys Speed & Custom Works AS; Strømsveien 266; 0668; OSLO; MOTORSYKKELOGMOPED; 971179465; 1471
DEKK1 AS Jæren; SOLAVEGEN 464; 4354; VOLL; HJUL, HENGERESPALOPSBREMSEANLEGG; 979579292; 30565
HALLINGDAL BILOPPRETTING;  ; 3550; GOL; BILSKADE; 966585315; 3547
Borg Bildemontering og Karosseri; Torvlia 7; 1739; Borgenhaugen; BILSKADE; 989710230; 155
Bilsenteret Bjugn AS; Bjugnveien 24; 7160; Bjugn; BILVERKSTED01, KONTROLLORGAN01; 984114117; 8428
Skoger Bilsenter AS; Meieribakken 4B; 3074; SANDE I VESTFOLD; KONTROLLORGAN01, BILVERKSTED01, BILSKADE; 919472987; 30551
OSLO FELGRETTING AS; Maria Dehlis vei 40; 1083; OSLO; HJUL; 811779032; 31056
Ryds Bilglass AS avd. Lade; Ivar Lykkes vei 4; 7075; TILLER; BILGLASS; 997722981; 29140
Express Bilservice AS; Sjømannsvegen 7; 6008; ÅLESUND; BILVERKSTED01, KONTROLLORGAN01; 984589808; 14139
Volmax AS, avd. Vikersund; Geithusveien 69; 3370; VIKERSUND; FARTSSKRIVER, BILVERKSTEDALLE, KONTROLLORGAN04, ALKOLASVERKSTED; 984674104; 24528
Bil i Nord Lofoten AS; Vorsetøyveien 25; 8300; SVOLVÆR; BILVERKSTED01, KONTROLLORGAN01; 887102562; 9261
KOKSTAD BILVERKSTED AS; Kokstadvegen 31; 5257; KOKSTAD; BILVERKSTED01B, KONTROLLORGAN01B; 996396819; 17720
Furnes Auto AS; Gjerluveien 65; 2320; FURNES; BILVERKSTED01; 896487752; 18019
STRYN BENSINSTASJON AS; TONNINGSGATA 2; 6783; STRYN; LYSUTSTYR, HJUL, EKSOSANLEGG; 935837685; 30416
Motor Forum AS Oslo; Østre Aker vei 62; 0581; OSLO; BILVERKSTED01, KONTROLLORGAN01; 822276482; 1535
DEKKPROFF AS, avd. Kristiansand; Barstølveien 29; 4636; KRISTIANSAND S; HJUL; 916725558; 30783
Riseberg MC og trafikkskole; Gurudveien 21; 1832; Askim; HJUL, EKSOSANLEGG, LYSUTSTYR; 974684918; 206
Badderen Servicesenter; Kvænangsveien 2380; 9162; SØRSTRAUMEN; BILVERKSTED01, KONTROLLORGAN01; 976764250; 23720
1DEKKBUTIKK.NO AS; HEMMINGSTADVEGEN 27; 5535; HAUGESUND; HJUL, BILGLASS; 817188222; 30043
POLARDEKK AS; NORDRE GATE 10; 8622; MO I RANA; HJUL; 915549993; 30766
BJØRN MOENS BILVERKSTED; Rafnesveien 10; 3965; HERRE; BILVERKSTED01, KONTROLLORGAN01; 970157824; 4861
Friisco Bilskadesenter AS; Industriveien 1; 8657; Mosjøen; BILSKADE; 931912852; 8812
HEMNES GLASS OG RAMMESERVICE ; Langstranda 5; 1970; HEMNES; BILGLASS; 971050810; 29531
Norsk Bilkontroll AS; PEDDELLEN 10; 3960; STATHELLE; KONTROLLORGAN01; 979322909; 28879
B.I.R Transport AS; PB 6004 Postterminalen; 5892; BERGEN; BILVERKSTED01, BILVERKSTED02, BILVERKSTED03, KONTROLLORGAN04; 984505469; 6515
M Nordvik AS; Sivert Nilsens gate 80; 8007; BODØ; KONTROLLORGAN01, BILVERKSTED01B; 960852338; 31370
Kanstad Mekaniske AS; Meistervik; 9055; Meistervik; PABYGGER; 936245692; 9510
VULMEK SIGMUND KRISTIANSEN; VOLLABAKKVEIEN 18; 9040; NORDKJOSBOTN; HJUL; 883946642; 29740
MADLA BILPLEIE & BILVASK AS; HILLEVÅGSVEIEN 100; 4016; STAVANGER; HJUL; 916137699; 30085
BIL OG ANLEGGSDEKK AS avd. Madla; Revheimsveien 74; 4043; HAFRSFJORD; HJUL; 932580861; 29276
Arka AS; Industriveien 11; 5200; OS; PABYGGER; 915303935; 6585
Wist Last og Buss AS; Fannestrandsvegen 51 b; 6416; Molde; FARTSSKRIVER, BILVERKSTEDALLE, KONTROLLORGAN04, ALKOLASVERKSTED; 958315120; 7698
RÅDE LAST OG HYDRAULIKK AS; ÅKEBERGMOSEN 19; 1640; RÅDE; BILVERKSTEDALLE, PABYGGER; 917466637; 30821
VIANOR OSLO BRYN; Brynsengveien 5; 0667; OSLO; HJUL, BILVERKSTED01, KONTROLLORGAN01; 935429447; 30531
Topp Auto AS  ; Strandgata 16; 2815; GJØVIK; BILVERKSTED01B, KONTROLLORGAN01B; 875944452; 2929
Sulland Bilskadesenter AS; Industrigata 26; 2619; LILLEHAMMER; BILSKADE; 856400662; 2630
VOLL BILVASK OG BILPLEIE BESTUN BESTUN SIDIQ MOHAMMED; VOLLVEGEN 53; 4354; VOLL; EKSOSANLEGG, HJUL; 820648102; 31166
Østbyen Bil og Karosseri A/S; Brusdalsvn. 244; 6011; ÅLESUND; BILVERKSTED01, BILSKADE, KONTROLLORGAN01; 984144644; 7369
Kverneland Bil AS avd. Bergen Åsane; Nordre Brurås 4, Haukås; 5131; NYBORG; BILVERKSTED01B, KONTROLLORGAN01B, BILSKADE; 977047684; 6660
DYRØY VEDLIKEHOLD; KVERNELANDSVEGEN 496; 4346; BRYNE; BILGLASS; 917400547; 30079
Stange Servicesenter AS; Torstadvegen 5; 2335; STANGE; BILVERKSTED01B, KONTROLLORGAN01B; 999056733; 25220
CARGLASS AS AVD LANGNES; Heilovegen 6; 9015; TROMSØ; BILGLASS; 923155333; 31294
HEIMDAL AUTOSERVICE AS; Kvenildstrøa 2C; 7093; TILLER; BILVERKSTED01, KONTROLLORGAN01; 962926606; 8030
BILMIX AS; Fosserveien 275; 1963; FOSSER; BILVERKSTED01; 918702741; 31143
ØGAARD & WILHELMSEN A/S; SUNDGATA 27; 2080; EIDSVOLL; HJUL; 947377469; 29434
Alf Graarud Motor AS; Haugeveien 8; 1738; Borgenhaugen; MOTORSYKKELOGMOPED; 931778757; 168
Berg Bil ; Lillestrømvn. 1640 Midtun; 1911; FLATEBY; BILVERKSTED01; 965057943; 1053
Amund Tanggård; Hummerbakken; 3294; STAVERN; BILVERKSTED01, KONTROLLORGAN01; 992565705; 16979
Karmsund Sveis & Påbygg A/S; Bønesvegen 70; 4260; TORVASTAD; PABYGGER; 972406104; 6447
DEKKTEAM KRISTIANSUND AS; Pilotveien 7; 6517; KRISTIANSUND N; HJUL; 991853227; 30226
SENJA AUTOSERVICE AS; ; 9372; GIBOSTAD; HJUL; 917425450; 29396
DEKKPROFF AS avd. Porsgrunn; EIKELIA 11; 3943; PORSGRUNN; HJUL; 916725558; 30960
LINDSKOG AUTO-SERVICE AS; ; 3895; EDLAND; HJUL; 942283865; 29321
Momrak Verkstad AS; Molandsmoen 5; 3870; Fyresdal; BILVERKSTED01B, KONTROLLORGAN01B; 898283852; 5130
HERØY BIL OG MASKIN AS; Sør-Herøyveien 2; 8850; Herøy; BILVERKSTED01, KONTROLLORGAN01; 965714049; 8806
Folla Bil & Båt AS; Storlavika; 7770; FLATANGER; BILVERKSTED01B, MOTORSYKKELOGMOPED, TRAKTOR, KONTROLLORGAN01B; 984036787; 13276
Hurdal Bil A/S; Øverbyvegen/Strand gård; 2090; HURDAL; BILSKADE; 979965966; 1239
MDESIGN AS; Gunnar Bergs vei 28; 8300; SVOLVÆR; HJUL; 913857461; 29793
Motor Technik AS; Rødmyrsvingen 60; 3735; SKIEN; BILVERKSTED01, KONTROLLORGAN01; 924661895; 30447
Toyota Romerike AS avd. Eidsvoll; Vognvegen 27; 2072; DAL; BILVERKSTED01, BILSKADE, KONTROLLORGAN01; 922754136; 1200
MINGES UNIVERSAL SERVICE AS; KROKSUNDVEIEN 40; 1860; TRØGSTAD; KONTROLLORGAN01, BILVERKSTED01; 813875012; 30504
STEINSPRUTEN BILGLASS AS; FORUSVEIEN 31; 4033; STAVANGER; BILGLASS; 997719670; 29529
Tor & Bjørn Autoservice AS; Storåkeren 9; 9411; HARSTAD; BILVERKSTED01, KONTROLLORGAN01; 939188282; 9425
Kvinnherad Bil & Teknikk AS; Teigarustene 1; 5460; Husnes; BILVERKSTED01, KONTROLLORGAN01; 983906818; 6731
Motor Forum AS; Ingvald Ludvigsengate 21; 3027; DRAMMEN; BILVERKSTED01, KONTROLLORGAN01, BILSKADE; 995515784; 16858
Skjærvik`s Scooter & MC AS; Saltfjellveien 426; 8615; Grubhei; MOTORSYKKELOGMOPED; 989165011; 8959
Porsche Center Stavanger AS; Fabrikkveien 41; 4067; STAVANGER; BILVERKSTED01, KONTROLLORGAN01; 989930877; 22821
Kristiansand Bilverksted AS; Rigedalen 10; 4626; Kristiansand; BILVERKSTEDALLE, KONTROLLORGAN01; 990693811; 5657
BILGLASS PROFF1 ANDRESEN; Plogveien 5; 7320; FANNREM; BILGLASS; 916687478; 30093
Autosenteret Løten AS; Dalstuvegen 1; 2340; LØTEN; BILVERKSTED01, KONTROLLORGAN01; 913406931; 26541
JÆREN STORBIL SENTER AS; LJOSHEIMSVEIEN 1; 4051; SOLA; HJUL, LYSUTSTYR, HENGERESPALOPSBREMSEANLEGG; 986348670; 30026
DEKK1 AS Bryne; Jærveien 152; 4344; BRYNE; HJUL; 979579292; 29272
DEKK OG DELER AS avd. Fyllingsdalen; HARDANGERVEGEN 150; 5226; NESTTUN; HJUL; 996430022; 31016
DEKKTEAM AS avd Eidsvoll; Industriveien 44; 2072; DAL; HJUL; 913774914; 29264
Hemnes Bil; Trinbergveien 7 B / Luteriet; 1970; HEMNES; BILSKADE; 993490482; 20540
Vagnild Bil; Aasen; 7288; SOKNEDAL; BILSKADE; 994904949; 17519
SHR AUTOSERVICE AS; INGESKOGEN 1; 6036; MAUSEIDVÅG; KONTROLLORGAN01, BILVERKSTED01, BILVERKSTED01B, KONTROLLORGAN01B; 919512768; 30730
MÅLØY AUTO AS; SJØGATA; 6702; MÅLØY; BILVERKSTED01B, KONTROLLORGAN01B; 988754846; 7120
Auto 1 Elnesvågen AS; Eidem; 6440; ELNESVÅGEN; BILVERKSTED01B, KONTROLLORGAN01B; 995419963; 16578
BILSKADESERVICE DRAMMEN AS; NEDRE EIKERVEI 26; 3045; DRAMMEN; BILSKADE; 889496592; 31398
Biltunet Verksted AS; Nygårdsveien 30; 1423; SKI; BILVERKSTED01, KONTROLLORGAN01; 988640484; 809
BILVERKSTED SENTRUM AS; CHRISTIAN KROHGS GATE 1; 0186; OSLO; BILVERKSTED01, KONTROLLORGAN01; 913432290; 28831
GJERSTAD AUTO AS; BROKELANDSHEIA NORD 3; 4993; SUNDEBRU; KONTROLLORGAN01, BILVERKSTED01; 922358117; 31127
KOMPLETT BILSERVICE AS; BUSKERUDVEIEN 124; 3027; DRAMMEN; BILVERKSTED01, KONTROLLORGAN01; 914524113; 28192
DEKK OG DELER BILVERKSTED SOTRA AS; TROLLHAUGMYRA 10; 5353; STRAUME; BILVERKSTED01, KONTROLLORGAN01; 919510447; 30577
TORLAND MASKIN AS; TORLANDSVEGEN 190; 4365; NÆRBØ; TRAKTOR; 989423940; 30075
Laastad & Co; Hjøllo; 5750; ODDA; BILVERKSTED01, KONTROLLORGAN01; 975941264; 6716
Kongsberg Bilservice DA; Skrubbmoen 12; 3619; SKOLLENBORG; BILVERKSTED01, KONTROLLORGAN01; 994282786; 14898
SCHAU'S BUSS AS; VESTBYVEIEN 15; 1543; VESTBY; BILVERKSTEDALLE, ALKOLASVERKSTED; 933658473; 29799
CARGLASS AS AVD STORD; ENSJØVEIEN 17; 0655; OSLO; BILGLASS; 923202676; 31367
Høyveg Mekaniske Verksted AS; Høyveg 23; 2662; DOVRE; BILVERKSTED01B, MOTORSYKKELOGMOPED, TRAKTOR, KONTROLLORGAN01B; 940471079; 2812
BJØRNAAS MOTOR; RÅKA 15; 7335; JERPSTAD; HJUL; 989468332; 29683
DEKKPROFF AS avd. Rygge; Kvaenveien 9; 1529; MOSS; HJUL; 916725558; 31183
Møller Bil Orkdal AS; Tiltaksvegen 1; 7300; ORKANGER; BILVERKSTED01, KONTROLLORGAN01; 834874482; 8324
Dahles Auto Fredrikstad AS; Stabburveien 3; 1617; FREDRIKSTAD; BILVERKSTED01B, KONTROLLORGAN01B; 962983251; 305
AQUASHINE BILPLEIE & DEKK AS; GLADENGVEIEN 16; 0661; OSLO; HJUL; 995855690; 28395
Nobina Norge AS; Jernkroken 2; 0976; OSLO; BILVERKSTED03, KONTROLLORGAN03; 915768237; 22681
KOLLSTAD LAKK & SANDBLÅSING AS; Ygnevegen 38; 2943; ROGNE; BILVERKSTED01; 997104331; 31091
Sande Auto AS avd. Hyundai - Subaru; Liamyrane 6; 5132; NYBORG; BILVERKSTED01, KONTROLLORGAN01; 946510939; 18099
GILDESKÅL  BIL OG BÅT A/S; Nygårdsjøen; 8120; NYGÅRDSJØEN; BILVERKSTED01B, KONTROLLORGAN01; 981695348; 9099
