Bilhjelp 1 AS; Badstutomta; 7100; RISSA; BILVERKSTED01B, MOTORSYKKELOGMOPED, KONTROLLORGAN01B; 983360467; 8422
EUROBIL AS; TRONDHEIMSVEIEN 436B; 0962; OSLO; BILVERKSTED01B, KONTROLLORGAN01B; 984070934; 30069
Vågsbygd Bensin & Service AS; Vågsbygd Ringv. 90; 4621; Kristiansand; BILVERKSTED01, KONTROLLORGAN01; 943586713; 5612
MC Oslo AS; Strømsveien 344; 1081; OSLO; MOTORSYKKELOGMOPED; 919050942; 1475
Nonslid Bilservice AS; Nygård; 5574; Skjold; BILVERKSTED01B, KONTROLLORGAN01B; 924514442; 6318
OPUS AS; Steinavegen 10; 6803; FØRDE; BILVERKSTED01, KONTROLLORGAN01, KONTROLLORGAN01B, BILVERKSTED01B; 943378649; 7032
Nilsen Bil; Haldenveien 1699 (Hjellebøl); 1960; LØKEN; BILVERKSTED01, KONTROLLORGAN01; 970096876; 1047
Kjøraas Bil A/S; Bromsveien 7; 3183; Horten; BILVERKSTED01, KONTROLLORGAN01; 976813545; 4115
AS BILDELER ÅLESUND; Postvegen 13; 6018; ÅLESUND; HJUL; 836657632; 30240
Birger N. Haug A/S avd. Lillestrøm; Depotgtata 12; 2000; LILLESTRØM; BILVERKSTED01, KONTROLLORGAN01; 952335863; 1001
Ivar Bråthen Mekaniske AS; Gubberudveien 132; 2312; Ottestad; PABYGGER; 979901925; 2055
RIIS MONTASJE AS avd. DRØBAK; Dyrløkkeveien 15; 1440; DRØBAK; BILGLASS; 921979436; 31335
JA DEKK AS; LANGARINDEN 8; 5132; NYBORG; HJUL; 995011085; 29379
RSA BIL Trondheim ; Vestre Rosten 71; 7072; HEIMDAL; KONTROLLORGAN01B, BILVERKSTED01B; 915518389; 30764
Bobilsenteret Namsos AS; Nøsthaugvegen 11; 7820; SPILLUM; BILVERKSTED01B, KONTROLLORGAN01B; 981524594; 12693
Maskinsenteret Vestland AS avd. Førde; Fjærevegen 15; 6800; FØRDE; TRAKTOR; 910787195; 26602
Braathen Bil; Skåla; 6456; SKÅLA; BILSKADE; 981535936; 16999
GS BILDELER AS; Styrmannsgata 1; 7042; TRONDHEIM; BILVERKSTED01, KONTROLLORGAN01; 980501515; 16879
Etne Auto AS avd Verksted; TONGANE 24; 5590; ETNE; BILSKADE, BILVERKSTED01B, KONTROLLORGAN01B; 913545311; 14178
VIANOR AS av. Leira i Valdres; Kongsvegen 10; 2920; LEIRA I VALDRES; BILVERKSTED01, KONTROLLORGAN01, HJUL; 935429447; 28258
Maskinservice. Morten Møll; Kverndalsveien 52; 4519; HOLUM; BILVERKSTED01, MOTORSYKKELOGMOPED; 913499573; 27582
Søgne Bilservice AS; LUNDEVEIEN 116B; 4640; SØGNE; BILVERKSTED01; 983908047; 31472
DEKKSENTERET FØRDE AS; SANDERPLASSEN 10; 6813; FØRDE; HJUL; 818458452; 30420
THANSEN AS; Lilletuneveien 3; 1711; SARPSBORG; HJUL; 923897682; 31409
Rongved Mekaniske AS; Rongved; 5286; HAUS; BILVERKSTED01, KONTROLLORGAN01; 982939534; 6654
BERGEN KOMMUNIKASJONSTEKNIKK AS; KOKSTADVEGEN 8; 5257; KOKSTAD; ALKOLASVERKSTED; 960432835; 31109
Winther-Hansen's Karosseri & Service; Jarlsøveien 14; 3124; Tønsberg; BILVERKSTED01B, KONTROLLORGAN01B; 974537257; 4375
KNAS  AS; Litleåsvegen 79; 5132; Bergen; PABYGGER; 985895104; 6528
Nordvik AS avd. Bjerka; Strandgata 12; 8643; BJERKA; BILVERKSTED01, KONTROLLORGAN01, BILSKADE; 946549770; 18259
AUTO FIRE AS; Bomvegen 8 ; 7725; Steinkjer; BILVERKSTED01, KONTROLLORGAN01; 947631055; 8643
MEKONOMEN SERVICES AS; Knivsøveien 16; 1787; HALDEN; BILVERKSTED01, KONTROLLORGAN01; 999323332; 30214
NORDSALTEN DEKK; HAUKÅS; 8290; SKUTVIK; HJUL; 972016845; 29693
Åsensenteret  Bilverksted AS; Auglendsmyrå 8; 4016; STAVANGER; BILVERKSTED01B, KONTROLLORGAN01B; 986343148; 5965
Kopervik Auto AS; Stølebuktvn 43; 4250; KOPERVIK; BILVERKSTED01B, KONTROLLORGAN01B; 938234973; 6310
HØYLAND BIL AS; Salhussletta 5; 8907; BRØNNØYSUND; BILVERKSTED01, KONTROLLORGAN01; 998425301; 13496
RAKKESTAD BIL & SERVICE AS; Sagveien 5; 1890; Rakkestad; BILVERKSTED01B, BILSKADE, MOTORSYKKELOGMOPED, KONTROLLORGAN01B; 991056424; 233
Opstad Auto AS; Skogveien 6A; 4330; Ålgård; BILSKADE; 999644031; 6229
Autodata AS; Torvaldslyst 30; 1738; BORGENHAUGEN; FARTSSKRIVER, ALKOLASVERKSTED; 963750129; 10003
Steinkjer Motorsenter AS; Hamnegata 20; 7714; STEINKJER; MOTORSYKKELOGMOPED; 976621824; 19421
Gulli Bilsenter AS; Barkåkerveien 85; 3157; Barkåker; BILVERKSTED01, KONTROLLORGAN01; 990779236; 4386
VIANOR AS avd Sandnes; Gjesdalveien 3; 4306; SANDNES; KONTROLLORGAN01, BILVERKSTED01; 935429447; 30281
NT Maskin AS; Arve Skjeflos veg 2B; 7713; STEINKJER; TRAKTOR; 993613770; 27541
LØKVOLL MOTELL OG AUTO-SENTER AS; LØKVOLLVEGEN 5; 9144; SAMUELSBERG; HJUL; 931903225; 29332
Bilskadesenteret Voss AS; Storviki 2; 5710; Skulestadmo; BILSKADE, PABYGGER; 988196282; 6960
BJUGN SERVICESENTER AS; Strandveien 2; 7160; BJUGN; BILGLASS, HJUL; 819892172; 29647
OLE OTTOSEN & SØNNER AS; TOPDALSVEIEN 350; 4658; TVEIT; PABYGGER; 976244230; 5695
Ørebekk Karosseriverksted A/S; Ålekilen; 1620; Gressvik; BILSKADE; 930203998; 320
SANDESSJØEN VERKSTEDSENTER AS; Øyvind Lambes v.17; 8800; Sandnessjøen; BILVERKSTED01B, KONTROLLORGAN01B; 979437218; 8809
Wist Last & Buss AS; Sandmoflata 4; 7093; TILLER; FARTSSKRIVER, BILVERKSTEDALLE, KONTROLLORGAN04, ALKOLASVERKSTED; 958315120; 8006
Bilia Lillestrøm; Cj Hansensvei 18. ; 2007; KJELLER; BILVERKSTED01, KONTROLLORGAN01; 976023188; 1006
STOA BIL AS; ÅSBIEVEIEN 16; 4848; ARENDAL; KONTROLLORGAN01, BILVERKSTED01; 912490890; 30788
Drammen karosseri as avd Tangen; Støperigata 7C; 3040; DRAMMEN; LYSUTSTYR, BILGLASS; 958540655; 29839
Kjellemo Bilverksted AS; Skibåsen 20J; 4636; KR.SAND; BILVERKSTED01, KONTROLLORGAN01, BILGLASS; 989261762; 5745
Auto Lakk A/S; Breivika Industrivei 61; 6018; Ålesund; BILSKADE; 982260612; 7337
Berge & Co AS, Avd. Florø; Evja; 6903; FLORØ; BILVERKSTED01, KONTROLLORGAN01; 951435325; 7096
Andersen Bil og Bilskade AS; Inger Floods vei 4; 3676; Notodden; BILVERKSTED01, KONTROLLORGAN01, BILSKADE; 999641199; 5113
RYDS BILGLASS AS; Stavsjøvegen 28 ; 7550; HOMMELVIK; BILGLASS; 913387783; 29496
Ride Bergen; Litleåsveien 49 Nyborg; 5132; Bergen; MOTORSYKKELOGMOPED; 982790344; 6743
FJORDANE CARAVAN AS; SANDERPLASSEN 4; 6813; FØRDE; LYSUTSTYR, HENGERESPALOPSBREMSEANLEGG; 914579759; 29628
AS ELVERUM KAROSSERIVERKSTED; Jernbanegata 7 A; 2406; ELVERUM; BILSKADE; 911422662; 2221
Toyota Sørvest A/S; Vestre Svanholmen 11; 4313; SANDNES; BILVERKSTED01, KONTROLLORGAN01; 937665482; 5931
KEPLER BILSERVICE AS; ANDEBUVEIEN 63; 3170; SEM; HJUL; 997499077; 31394
MOBILE SØRLANDSPARKEN AS; Skibåsen 4; 4636; KR.SAND; BILVERKSTED01, BILSKADE, KONTROLLORGAN01; 946252611; 5705
Snap Drive AS avd. Ski; Tegelveien 17; 1400; SKI; BILVERKSTED01, KONTROLLORGAN01; 971585188; 12952
SÆTERNES TRANSPORT AS; Sørveien 35; 7900; RØRVIK; HENGERESPALOPSBREMSEANLEGG, HJUL, KONTROLLORGAN04, BILVERKSTEDALLE; 980652386; 28756
Selje Auto AS; Selje sentrum, Nabben; 6740; SELJE; BILVERKSTED01, KONTROLLORGAN01; 912068684; 25461
Volvo Buss Drammen; Damsrudveien 55; 3045; DRAMMEN; BILVERKSTED03; 910712799; 21681
Snertingdal Bil og Bilpleie AS; Snertingdalvegen 1748; 2838; SNERTINGDAL; BILVERKSTED01, KONTROLLORGAN01; 912470334; 27841
Bulder Verksted AS, avd. Alta; Aronnesveien 48; 9514; Alta; BILVERKSTED01, BILVERKSTED02, BILVERKSTED03, TRAKTOR, KONTROLLORGAN04, FARTSSKRIVER; 993026352; 9607
STRAND AUTOSERVICE AS; BERGTUNVEGEN 1; 4120; TAU; LYSUTSTYR, BILVERKSTED01, KONTROLLORGAN01, HJUL, EKSOSANLEGG; 811900532; 28759
DIGERUD DEKKSERVICE AS; Gaupevegen 8; 2211; KONGSVINGER; HJUL; 998020980; 30028
Bilsenteret Stavanger AS; Hillevågsveien 103; 4016; STAVANGER; BILVERKSTED01, BILSKADE, KONTROLLORGAN01; 967819085; 6055
NORD - AUTO VERDAL AS; Venusvegen 10B; 7652; VERDAL; BILVERKSTED01, KONTROLLORGAN01; 935253128; 8563
Ekeri Norge AS;  Hunnselvvegen 10; 2830; RAUFOSS; PABYGGER; 987620412; 2936
Glommen Bil AS; Kongsvingervegen 3031; 2166; OPPAKER; BILVERKSTED01, KONTROLLORGAN01; 971001968; 1215
Lyseng Billakkering; Norderhovsveien 23; 3512; Hønefoss; BILSKADE; 855135752; 3310
ESPELAND REKVISITASENTER AS avdeling Karosseri; Liavegen 2; 5132; NYBORG; BILSKADE; 989287354; 29343
KVAVIK DEKK & REP AS; Åneveien 7; 4580; LYNGDAL; BILVERKSTED01, KONTROLLORGAN01; 818673582; 30408
DALSET BIL & KAROSSERI AS; Østre Aker vei 60; 0581; Oslo; BILVERKSTED01, BILSKADE; 979476892; 1428
DEKKTEAM AS avd. Tromsø; Skattøravegen 50; 9018; TROMSØ; HJUL; 870897332; 29696
RØROS LAST OG BUSS AS; TOLLEF BREDALS VEI 6; 7374; RØROS; KONTROLLORGAN04, BILVERKSTEDALLE, FARTSSKRIVER; 917015511; 29932
TESLA MOTORS NORWAY AS avd. Brumunddal; Strandvegen 26; 2380; BRUMUNDDAL; BILVERKSTED01; 917303983; 29474
thansen AS, Avd Lyngdal; Fiboveien 10; 4580; LYNGDAL; HJUL; 923897682; 31344
SKANCKE AS; Stamphusveien 3; 7374; RØROS; BILVERKSTED01B, TRAKTOR, KONTROLLORGAN01B, MOTORSYKKELOGMOPED; 976545281; 8359
Aarsby Bil AS; Hvamsvingen 5; 2013; SKJETTEN; BILVERKSTED01, KONTROLLORGAN01; 914974399; 22460
HÆHRE & ISACHSEN AUTO AS; HEGGENVEIEN 11; 3370; VIKERSUND; BILVERKSTED01, KONTROLLORGAN01; 917188807; 30454
Nordvik AS avd. Brønnøysund; Russesletta 5; 8907; BRØNNØYSUND; BILVERKSTED01B, KONTROLLORGAN01B; 946549770; 29978
LØHRE AS; Fossaavegen 10; 7900; Rørvik; BILVERKSTED01, KONTROLLORGAN01, HJUL; 935555361; 8763
Tromsø Billakkering AS; Ringveien 650; 9017; TROMSØ; BILSKADE; 942037538; 9515
Harila AS avd. Alta; Betongveien 3A; 9515; ALTA; BILVERKSTED01, KONTROLLORGAN01; 917630747; 9629
GLASS & LÅSSERVICE HAUGESUND AS; LONGHAMMERVEGEN 19; 5536; HAUGESUND; BILGLASS; 981911180; 29593
Auto 8-8- Forum avd. Florø; Leirvåggata 1; 6909; FLORØ; BILVERKSTED01, KONTROLLORGAN01; 959167915; 7036
Aarsland Bil AS; Industrigata 2; 4362; VIGRESTAD; BILVERKSTED01, KONTROLLORGAN01; 921688482; 6214
Teknisk Bureau AS avd. Last; Skattøraveien 48; 9018; TROMSØ; FARTSSKRIVER, BILVERKSTED02, BILVERKSTED03, KONTROLLORGAN04, ALKOLASVERKSTED; 925162728; 9537
DEKK1 AS Drammen; TEGLVERKSVEIEN 11B; 3413; LIER; HJUL; 979579292; 31315
Lyngseidet Bilverksted AS; Skoleveien 1; 9060; Lyngseidet; BILVERKSTED01, KONTROLLORGAN01; 958755287; 9507
NAF Senter Finnsnes ; Botnhågenveien 10; 9300; Finnsnes; KONTROLLORGAN01, BILVERKSTED01; 987372540; 9840
MEKONOMEN SERVICES AS, avd. Sluppen; Bratsbergveien 11; 7037; TRONDHEIM; BILVERKSTED01, KONTROLLORGAN01, MOTORSYKKELOGMOPED; 922093423; 31388
Auto Service  (Valle); Nordbergvegen 218; 4747; Valle; BILVERKSTED01; 835488772; 5343
Funnemark Sandefjord AS; Pindsleveien 15; 3221; SANDEFJORD; BILVERKSTED01, KONTROLLORGAN01; 939052429; 4733
Etac Bil AS avd. Tresfjord; Sylte; 6391; TRESFJORD; BILVERKSTED01, PABYGGER; 999065465; 23181
Knutsen Auto Service AS; Ytrebygdsveien 244; 5258; BLOMSTERDALEN; BILVERKSTED01, KONTROLLORGAN01; 997504852; 20179
BIL i NORD AS avd. Mo i Rana; Steinbekkhaugveien 15; 8610; Mo i Rana; BILVERKSTED01, KONTROLLORGAN01; 983666280; 8911
MYSEN BILGLASS; VANDUGBAKKEN 18; 1850; MYSEN; BILGLASS; 982613426; 29584
IVAR & TRYGVES BILVERKSTED AS; Valveien 48; 8900; Brønnøysund; BILVERKSTED01B, KONTROLLORGAN01B, MOTORSYKKELOGMOPED; 971130229; 8850
ERIK ARNESEN BRYN AS avd Audi; NILS HANSENS VEI 1; 0667; OSLO; KONTROLLORGAN01, BILVERKSTED01; 976547551; 29252
SKOLLERUD AUTO Thomas Hesleskaug; Skollerudveien 126; 1852; MYSEN; BILVERKSTED01; 988325996; 15519
Hjelmeland Auto Senter AS; Hjelmeland; 4130; Hjelmeland; BILVERKSTED01, KONTROLLORGAN01; 929652630; 6068
LEIKANGER AUTO AS; HANAHAUG 10; 6863; LEIKANGER; BILVERKSTED01, KONTROLLORGAN01; 924328606; 7218
NYLØKKEN DEKK; ROMSDALSVEGEN 2342; 2666; LORA; HJUL; 869194212; 31206
Birger N. Haug A/S, avd. Oslo; Haraldrudveien 9; 0581; OSLO; BILVERKSTED01, KONTROLLORGAN01; 952335863; 1317
RUDSKOGEN BILLAKKERING JAN-E HOLØS; SKANTEBYGDAVEIEN 16; 1894; RAKKESTAD; BILSKADE; 970428488; 30083
Peter Brauten Eftf AS; Melkvegen 43; 7870; GRONG; BILVERKSTED01, KONTROLLORGAN01; 996851915; 27583
DOKKA BILPLEIE AS; STORGATA 105; 2870; DOKKA; HJUL, BILGLASS; 981129296; 30074
Åkra Bilimport AS avd. bilskade; Rådhusvegen 114; 4270; ÅKREHAMN; BILSKADE; 918407820; 21701
Raufoss Bil & Motor AS; Storgata 69; 2830; Raufoss; BILVERKSTED01, KONTROLLORGAN01; 987112859; 2934
SNIPPEN BILSERVICE AS; OVERHALLSVEIEN 5-7; 7803; NAMSOS; BILVERKSTED01, KONTROLLORGAN01; 958330537; 29275
Møller Bilskadesenter Vestfold AS; Broen ; 3170; Sem; BILSKADE; 946967874; 4321
Volvo Truck Center AS avd Lillestrøm; Leiraveien 12; 2000; LILLESTRØM; FARTSSKRIVER, BILVERKSTED03, KONTROLLORGAN03; 910712799; 17060
Rena Bilberging; Hovdmovegen 4; 2450; Rena; BILVERKSTED01B, KONTROLLORGAN01B; 979521294; 2256
CARGLASS AS, avd Mjåvann; Mjåvannveien 18; 4628; KRISTIANSAND S; BILGLASS; 985758220; 28811
Otto Moe AS avd Rørvik; Betzy Bergsgt. 2; 7900; Rørvik; BILVERKSTED01B, KONTROLLORGAN01B; 916125844; 8750
EKEBERG AUTO    AS; Sentrumsveien 116; 3748; SILJAN; BILVERKSTED01, KONTROLLORGAN01; 957113737; 4828
Wist Last & Buss AS; Sødalen Industriområde; 6520; Frei; FARTSSKRIVER, BILVERKSTEDALLE, KONTROLLORGAN04; 958315120; 7856
MAUSEIDVÅG BILVERKSTED AS; Mauseidvågveien 40; 6036; MAUSEIDVÅG; BILVERKSTED01B, KONTROLLORGAN01B, KONTROLLORGAN01, BILVERKSTED01; 916807473; 30070
Norsk Scania AS avd. Gjøvik; Nedre Holmen veg 3; 2827; HUNNDALEN; FARTSSKRIVER, BILVERKSTEDALLE, ALKOLASVERKSTED, KONTROLLORGAN03; 879263662; 2938
BJØRN BERGE BENSINSTASJON AS; SAM EYDES GATE 55; 3660; RJUKAN; HJUL, LYSUTSTYR; 980148831; 29863
Teknisk Bureau Sortland AS; Strandgata 60; 8403; SORTLAND; BILVERKSTED01B, KONTROLLORGAN01B; 935396387; 9340
PETER-PAN AS; INDUSTRIVEGEN 37; 5210; OS; HJUL; 817338852; 31296
GAMLEBYEN BILVASK OG BILPLEIE AS; St. Halvards gate 33; 0192; OSLO; HJUL; 921059051; 31242
TK ØKONOMITRIMMING AS; Sandbakken 6; 2413; ELVERUM; BILVERKSTED01, KONTROLLORGAN01; 913387880; 31247
Bertel O. Steen Buskerud AS; Vestre Linnesvei 11; 3414; LIERSTRANDA; BILVERKSTED01, KONTROLLORGAN01; 948017539; 3788
NAF Senter Åsane; Liamyrane 6 ; 5132; NYBORG; KONTROLLORGAN01; 987372540; 23440
AUTO TYNSET A/S; Risegga; 2500; Tynset; BILVERKSTED01B, KONTROLLORGAN01B; 971587407; 2319
JENSENS BIL-SERVICE; ING. RYBERGSGT. 104; 3027; DRAMMEN; BILVERKSTED01, KONTROLLORGAN01; 982831245; 3634
Nor-In Bruktbil og Sveis; Bjerkåsveien 1; 1391; VOLLEN; KONTROLLORGAN01, BILVERKSTED01; 957552633; 992
Star Autoco AS, avd. Lørenskog; Solheimveien 62; 1473; SKÅRER; BILVERKSTED01, KONTROLLORGAN01; 925905526; 1130
DEKK1 AS avd 110 Sandnes; Gravarsveien 30; 4306; SANDNES; HJUL, HENGERESPALOPSBREMSEANLEGG; 979579292; 29034
KROKEN SERVICESENTER KENT ROBERTSEN; ANTON BORCHS VEG 5; 9022; KROKELVDALEN; HJUL; 884361982; 31195
BILENS EKSOSANLEGG BERGEN AS; NEDBERGEVEIEN 9; 5178; LODDEFJORD; EKSOSANLEGG; 976300165; 29380
Midthus Maskin; Sletta; 2850; LENA; BILVERKSTED01; 994831593; 18561
Tønsberg Kommune ; Kilengata 24; 3117; Tønsberg; BILVERKSTED01B; 921383681; 4391
INDRE ØSTFOLD BILGLASS SERVICE AS; SAGVEIEN 1A; 1814; ASKIM; BILGLASS; 993324558; 29576
LØNSETHAGEN ELEKTRO - DIESEL AS; Skålavegen 3; 6422; Molde; BILVERKSTED01B, BILELEKTRODRIVSTOFFANLEGG; 979463448; 7613
POLE POSITION AS; RØYKÅSVEIEN 5; 1473; LØRENSKOG; HJUL; 992095830; 29847
Fixbil Knarvik AS; Kvassnesvegen 41; 5914; ISDALSTØ; BILVERKSTED01, KONTROLLORGAN01; 985283796; 6662
GAUPNE BIL & OPPRETTING AS; GAUPNE; 6868; GAUPNE; BILVERKSTED01, BILSKADE, KONTROLLORGAN01; 968267299; 7240
ELVERUM AUTO BILSALG AS; Meierigata 3-5; 2406; Elverum; BILVERKSTED01B, KONTROLLORGAN01B; 911421046; 2205
HARSTAD DEKKSENTER AS; STANGNESTERMINALEN 13; 9409; HARSTAD; HJUL; 912068587; 29290
STORD DEKKSERVICE AS; RUNDEHAUGEN 31; 5412; STORD; HJUL, HENGERESPALOPSBREMSEANLEGG, LYSUTSTYR; 950470631; 30607
HANDICARE AS; Fabrikkveien9; 4033; STAVANGER; PABYGGER; 965395830; 30010
KIRKENG BIL AS; Storgata 26; 1890; Rakkestad; BILVERKSTED01B, BILSKADE, KONTROLLORGAN01B; 981886828; 215
M Nordvik AS avd. Mosjøen; Øyfjellgata 12; 8656; MOSJØEN; BILVERKSTED01B, KONTROLLORGAN01B; 960852338; 31346
US Car Clinic AS; Østre Rosten 4C; 7075; TILLER; BILVERKSTED01B, KONTROLLORGAN01B; 881240262; 8099
Møller Bil Molde; Verftsgata 3; 6402; Molde; KONTROLLORGAN01B, BILVERKSTED01B; 915555292; 7604
CARGLASS AS, avd. Hadeland; Sørvangsbakken 23; 2770; JAREN; BILGLASS; 985758220; 30286
Tores Auto Arna AS; STORANESET 24; 5260; INDRE ARNA; BILVERKSTED01, KONTROLLORGAN01; 997744470; 21180
NORDBY BILVERKSTED AS; Haugenveien 27; 1400; SKI; KONTROLLORGAN01, BILVERKSTED01, BILGLASS; 921066767; 31003
VIANOR AS. Avd Bodø; Dreyfushammarn 15; 8012; BODØ; HJUL; 935429447; 29360
BENNYS MOTOR BENNY RENNE SOLBAKK; JOENGET 45; 7170; ÅFJORD; HJUL, HENGERESPALOPSBREMSEANLEGG, EKSOSANLEGG; 984211848; 29746
Fix Bil Landås Bilverksted AS; Kolstien 2; 5097; BERGEN; BILVERKSTED01, KONTROLLORGAN01; 985375186; 6769
Lommedalen Auto AS; Skollerud vn 140; 1350; Lommedalen; BILVERKSTED01, KONTROLLORGAN01; 984668252; 913
BJERLAND LAKK OG KAROSSERI AS; SKARPENGLAND; 4715; ØVREBØ; BILGLASS, LYSUTSTYR; 977193788; 30345
Vrådal Bilsenter; Kviteseidvegen 1883a; 3853; Vrådal; BILVERKSTED01B, KONTROLLORGAN01B; 969966719; 5128
Varhaugs Diesel Elektro AS; Bedriftsveien 24; 4313; SANDNES; BILELEKTRODRIVSTOFFANLEGG, BILDIESEL; 934418867; 5988
MÆLAND AUTOSENTER AS; Røysumvegen 3; 3802; BØ I TELEMARK; HJUL; 950032340; 30149
HARSTAD BIL-GLASS SERVICE AS; VERKSTEDVEGEN 15; 9406; HARSTAD; BILGLASS; 957516335; 28632
Gabriel Østråt AS; Bedriftsvn 11 ; 4313; SANDNES; BILVERKSTED01B, BILSKADE, KONTROLLORGAN01B; 937817983; 5918
Asker Bilservice AS; Askerveien 61; 1384; Asker; BILVERKSTED01, KONTROLLORGAN01; 985058113; 936
Snap Drive Åssiden; Ingeniør Rybergsgate 44; 3024; DRAMMEN; BILVERKSTED01, KONTROLLORGAN01; 971585188; 3772
TOYOTA BILIA AS, AVD STJØRDAL; Tuftenvegen 2; 7502; STJØRDAL; BILVERKSTED01, BILSKADE, KONTROLLORGAN01; 980648915; 29386
SAND SERVICESENTER AS; Verven 5; 4230; SAND; BILVERKSTED01B, KONTROLLORGAN01B; 994830503; 29308
Norsk Scania AS avd. Bardufoss; Andslimoen; 9325; Bardufoss; FARTSSKRIVER, BILVERKSTED01, BILVERKSTED02, BILVERKSTED03, TRAKTOR, KONTROLLORGAN03; 879263662; 9828
DEKKCENTERET AS; LERSTADVEGEN 302; 6014; ÅLESUND; HJUL; 928336042; 30238
Slatlem Molde AS; Hendenvegen 5; 6423; MOLDE; BILVERKSTED01, KONTROLLORGAN01; 917339791; 7617
MVERKSTED AS; NAMSOSVEGEN 1036; 7730; BEITSTAD; KONTROLLORGAN01, BILVERKSTED01B; 917372012; 30004
Volvo Truck Center avd Fagerstrand; Torneveien 10; 1454; FAGERSTRAND; BILVERKSTED03, ALKOLASVERKSTED; 910712799; 29956
Madland Bilverksted AS; Finnestadgeilen 20; 4029; Stavanger; BILVERKSTED01B, BILVERKSTED02, BILVERKSTED03, BILBREMSE, KONTROLLORGAN01B, KONTROLLORGAN02, KONTROLLORGAN03, FARTSSKRIVER, TRAKTOR; 935439868; 6091
Egenes Brannteknikk AS; Nulandsvika 3; 4400; FLEKKEFJORD; PABYGGER; 966861320; 14958
Mjøsbil AS avd. Vågå; INDUSTRIVEGEN 40; 2680; VÅGÅ; KONTROLLORGAN01, BILVERKSTED01; 950223243; 29672
MOTOR FORUM Hamar AS; Vangsvegen 91; 2317; HAMAR; BILVERKSTED01B, BILSKADE, KONTROLLORGAN01B; 911907232; 2058
Best Bilsenteret AS; Hotvetalleen 3; 3018; DRAMMEN; KONTROLLORGAN01, BILVERKSTED01, BILSKADE; 916594658; 30476
Bilhuset Førde AS; Øyrane 6; 6803; FØRDE; BILVERKSTED01B, KONTROLLORGAN01B; 994271725; 7085
MC GARASJEN AS; TJELDBERGET 2; 8012; BODØ; MOTORSYKKELOGMOPED; 819935602; 30723
Ford Harstad AS; Storåkeren 15   ; 9411; Harstad; BILVERKSTED01, BILSKADE, KONTROLLORGAN01; 966550570; 9441
Mosfjell Bil AS; Mosfjell; 4760; BIRKELAND; BILVERKSTED01, KONTROLLORGAN01; 984076703; 15818
KOPPANG AUTO A/S ; Kjemsjøveien 22; 2480; Koppang; BILVERKSTED01, KONTROLLORGAN01; 932412063; 2324
TIDE VERKSTED AS avd. Haugesund; Leirangergata 31; 5522; HAUGESUND; FARTSSKRIVER, BILVERKSTED02, BILVERKSTED03, KONTROLLORGAN04; 918152954; 30200
City Bil a/s; Malergata 1; 3117; Tønsberg; BILVERKSTED01B, KONTROLLORGAN01B; 946057606; 4304
Steigen Vekst AS; Furulund; 8283; LEINESFJORD; BILVERKSTED01B; 876516012; 23480
CRUX Tilja oppfølgingssenter ; Bølevegen 2; 3724; SKIEN; MOTORSYKKELOGMOPED, BILVERKSTED01; 975387011; 31156
RSA BIL Kristiansand; Barstølveien 30, Pb 9235 Sørlandsparken; 4697; KRISTIANSAND S; BILVERKSTED01B, KONTROLLORGAN01B; 915518389; 11132
OPPLÆRINGSKONTORET FOR BILFAG AS; BJØRNDALEN 3; 7028; TRONDHEIM; BILVERKSTED01B; 945302577; 29941
BOBIL TRONDHEIM AS; INDUSTRIVEIEN 39A; 7080; HEIMDAL; BILVERKSTED01B, KONTROLLORGAN01B; 917921024; 30553
Speed Motorcenter AS; Skolmar 30; 3232; SANDEFJORD; MOTORSYKKELOGMOPED; 928949214; 4731
Hoel Mekaniske Verksted; Hevle; 7340; OPPDAL; TRAKTOR; 996482324; 22079
Herefoss Bruk AS; Stasjonsbyen 53; 4766; Herefoss; BILVERKSTEDALLE, KONTROLLORGAN01B, TRAKTOR; 852596562; 5335
Ringerike Trailerservice AS; Nordmoen; 3534; SOKNA; PABYGGER; 986760881; 3385
Bergan Maskinsalg AS; Åshaugveien 94; 3170; SEM; TRAKTOR; 969012758; 19024
Snap Drive AS avd. Hvam; Jogstadveien 27; 2007; KJELLER; BILVERKSTED01, KONTROLLORGAN01; 971585188; 18439
Rogaland Bilverksted AS; Midtbergveien 2; 4313; Stavanger; BILVERKSTED01, KONTROLLORGAN01; 985621330; 6167
Alta Autosenter AS; Altaveien 73; 9513; ALTA; BILVERKSTED01, KONTROLLORGAN01; 877179532; 9616
SIGDAL BIL & LANDBRUK V/ PER KRISTIAN KRISTIANSEN; Vestre Grønseth; 3355; SOLUMSMOEN; BILSKADE, BILVERKSTED01; 897928302; 29889
DEKKMANN AS AVD BÆRUM 5250; Olav Ingstads vei 1; 1351; RUD; HJUL; 974292831; 30134
SENSO AUTO A/S; Åheim; 6146; Åheim; BILVERKSTED01, KONTROLLORGAN01, HJUL; 980348768; 7552
Møgedal Mekaniske verkstad AS; Sandsvegen 261 ; 4230; SAND; TRAKTOR; 987558261; 18980
Madla Bil AS; Revheimsvn 74; 4043; Hafrsfjord; BILVERKSTED01, MOTORSYKKELOGMOPED, KONTROLLORGAN01; 987768088; 6159
Toyota Flekkefjord AS; Trøngsla 3; 4400; Flekkefjord; BILVERKSTED01, KONTROLLORGAN01; 979779755; 5829
Eiksenteret Hønefoss; Barbroveien 7; 3511; HØNEFOSS; MOTORSYKKELOGMOPED, TRAKTOR; 936372023; 20463
TEVO DEKK AS AVD STJØRDAL; Havnegata 41; 7502; STJØRDAL; HJUL; 995179989; 29424
Vestfossen Bil Og Karosseri; Bruksgata 21 ; 3320; VESTFOSSEN; BILVERKSTED01B, BILSKADE; 977241189; 3785
Kvan Consult; Holtungveien 70; 3080; HOLMESTRAND; BILSKADE; 982397499; 4196
Heistad Bil & Caravan A/S; Heistaddalen 37; 3940; Porsgrunn; BILVERKSTED01B, KONTROLLORGAN01B; 984204507; 4911
Bilcentrum AS; Leangen alle 6; 7044; TRONDHEIM; BILVERKSTED01B, KONTROLLORGAN01B; 836883772; 8052
MOSS DEKK AS; RABEKKGATA 3; 1523; MOSS; HJUL; 921836686; 31080
GREÅKER GLASS OG RAMMEFORRETNING AS; GREÅKERVEIEN 138; 1718; GREÅKER; BILGLASS; 985813582; 29686
Benz Technic AS; Tillerbruveien 157; 7092; TILLER; BILSKADE; 923105417; 11475
CARGLASS AS avd. Sandvika; Elias Smiths vei 10; 1337; SANDVIKA; BILGLASS; 985758220; 29074
GRAN DEKK OG SERVICESENTER AS; HOVSGUTUA 1; 2750; GRAN; HJUL; 916478143; 31493
Felleskjøpet Agri SA avd. Tynset; Tomtegata 4; 2500; TYNSET; TRAKTOR; 911608103; 18939
DEKKMANN AS avd Setermoen; Industriveien 5  ; 9360; BARDU; HJUL, HJULUTRUSTNING; 966242825; 29269
RIIS MONTASJE AS; Vestsivegen 67; 2411; ELVERUM; BILGLASS; 921979436; 30941
OVERAAE AS; Østre Rosten 6A; 7075; TILLER; HJUL, HJULUTRUSTNING; 935872634; 29349
S R BILRADIO AHMAD WAQAR; RYENSVINGEN 11B; 0680; OSLO; HJUL; 942199090; 31219
GRIDSVÅG BÅT MOTOR AS; GRIDSVÅGVEGEN 119; 6698; LESUND; HJUL, BILGLASS, LYSUTSTYR, HENGERESPALOPSBREMSEANLEGG, PABYGGER; 984413793; 30394
CARGLASS AS AVD FREDRIKSTAD SENTRUM; Apenes gate 16; 1607; FREDRIKSTAD; BILGLASS; 992940581; 31184
Nor-Slep AS; Borgeskogen 48; 3160; STOKKE; PABYGGER; 933730050; 4704
HETLE AUTO ANR AS; REED; 6827; BREIM; BILVERKSTED01, KONTROLLORGAN01B; 916569505; 29824
Vianor AS, avd. Vinje; Verkstadvegen 1; 3890; Ytre Vinje; FARTSSKRIVER, BILVERKSTED01, BILVERKSTED02, BILVERKSTED03, KONTROLLORGAN04; 935429447; 5219
DEKK OG DELER AS avd. Stord; Lyngneset 1; 5410; SAGVÅG; HJUL; 996430022; 31019
VIANOR AS; Kjørbekkdalen 7; 3735; SKIEN; HJUL; 935429447; 30736
Johanssons Auto AS; Gigstads vei 10; 3511; HØNEFOSS; BILVERKSTED01, KONTROLLORGAN01; 997091973; 3428
Last Haugesund AS; Ekrene Næringspark 15; 5550; SVEIO; FARTSSKRIVER, BILVERKSTED01, BILVERKSTED02, BILVERKSTED03, TRAKTOR, KONTROLLORGAN04; 991393587; 10711
PRO AUTO SERVICE AS; BIRKEBEINERVEIEN 5; 3517; HØNEFOSS; KONTROLLORGAN01, BILVERKSTED01; 923661875; 31405
DEKKTEAM AS avd. Skarnes; Slomarka 22; 2100; SKARNES; HJUL; 870897332; 29879
DEKK-SKIFT SOMMERFELDT AS; HILLEVÅGSVEIEN 102; 4016; STAVANGER; HJUL; 912686760; 29831
Møller Bil Sør-Rogaland As avd Møller Bil Stavanger; Vassbotnen 17                         ; 4067; STAVANGER; BILVERKSTED01B, KONTROLLORGAN01B; 933625583; 5908
A-K Maskiner AS, avd Stjørdal; Industrivegen 2; 7502; STJØRDAL; TRAKTOR; 946468037; 18440
SULLAND MOSS FORD; Varnaveien 30; 1526; MOSS; BILVERKSTED01B, KONTROLLORGAN01B, BILSKADE; 911352400; 30703
DRAMMEN KAROSSERI AS; Kobbervikdalen 75; 3044; DRAMMEN; BILSKADE; 958540655; 3682
Lunde Lastebilverksted AS; Hovedgata 19; 3825; LUNDE; BILVERKSTED01, BILVERKSTED02, BILVERKSTED03, PABYGGER, KONTROLLORGAN04; 984673639; 4870
Autoskade Tynset AS; Bangmoen; 2500; TYNSET; BILVERKSTED01, BILSKADE; 999257305; 26721
BROMTECH TOM EDDIE JACOBSEN; DRASUNDVEIEN 2A; 3189; HORTEN; BILVERKSTED01; 917693749; 30087
Solberg Bil Notodden A/S; Merdevegen 6; 3676; NOTODDEN; BILVERKSTED01B, KONTROLLORGAN01B; 979503156; 5123
Bil Rep AS; Holmejordetveien. 40; 3267; LARVIK; BILVERKSTED01B, MOTORSYKKELOGMOPED, BILSKADE, KONTROLLORGAN01B; 988083186; 4649
TORVIK VERKSTED AS; STRØMSVEIEN 223; 0668; OSLO; HJUL; 916841817; 30053
TK  Motor  Alta  AS; Storengveien 21; 9515; ALTA; BILVERKSTED01, MOTORSYKKELOGMOPED, BILSKADE, KONTROLLORGAN01; 968457675; 9624
Nordvik AS avd. Sortland; Vesterålsgata 26; 8400; SORTLAND; BILVERKSTED01, KONTROLLORGAN01, BILSKADE; 946549770; 9382
GRANDAHL VERKSTED AS; LILLETUNEVEIEN 6B; 1711; SARPSBORG; BILVERKSTED01, KONTROLLORGAN01; 919656999; 30569
TJELMANE DEKKSERVICE AS; GÅSAVIKJA 1; 4230; SAND; HJUL; 979692870; 29445
Rolf Wee Transport AS avd. Påbygg ; Frakkagjerdvegen 127; 5563; Frakkagjerd; PABYGGER; 970998136; 6375
Bilia Furubakken AS; Ramstadsletta 15; 1363; Høvik; BILVERKSTED01, KONTROLLORGAN01; 976023188; 947
SVENDSEN EKSOS SKIEN AS; BEDRIFTSVEGEN 42; 3735; SKIEN; EKSOSANLEGG, HJUL; 980416534; 30819
TILHENGERSPESIALISTEN AS; HEIANE 6; 5131; NYBORG; HENGERESPALOPSBREMSEANLEGG; 957643876; 31085
BIRGER N HAUG AS avdeling Røyken; Johan Follestads vei 15; 3474; ÅROS; BILVERKSTED01, KONTROLLORGAN01; 952335863; 29792
Lena Maskin AS avd. Dokka; Storgata 113; 2870; DOKKA; TRAKTOR; 941263003; 19679
STRANDA BILSERVICE JONNY HAMMER; Dalevegen 7; 6200; STRANDA; HJUL, EKSOSANLEGG; 957711707; 29262
AUTOCON ARNE GEORG HOLTH; RUDVEIEN; 3540; NESBYEN; HJUL; 991139842; 29806
